0	1	About how many countries are there in the world?	200
1	1	Alaska is the largest state in the United States.	True
2	1	All of the following are towns/villages in the Pacific Island nation of Kiribati EXCEPT:	Urutora
3	1	Bosnia and Herzegovina is a country located in the Baltic region in Europe.	False
4	1	Broome is a town in which state of Australia?	Western Australia
5	1	How many US states start with the letter K?	Two
6	1	How many countries does Spain have a land border with?	5
7	1	How many countries share a land border with Russia? (Not including disputed territories)	14
8	1	How many provinces are in the Netherlands?	12
9	1	How tall is One World Trade Center in New York City?	1,776 ft
10	1	In 2012 the German-speaking microstate "Liechtenstein" in Central Europe had a population of how many inhabitants?	36,600
11	1	In the Canadian province of Alberta, the city of Calgary is located further north than the city of Edmonton.	False
12	1	In which English county is the city of Portsmouth?	Hampshire
13	1	Italy and Ireland are the only countries in Europe that start with the letter I.	False
14	1	Kuala Lumpur is the capital of which country?	Malaysia
15	1	Llanfairpwllgwyngyllgogerychwyrndrobwllllantysiliogogogoch is located on which Welsh island?	Anglesey
16	1	Miami is Florida's largest city.	False
17	1	On which continent does the Andes mountain range lie?	South America
18	1	Route 66 in the United States spans the entire mainland of America, from California to New York.	False
19	1	Santorini is an island belonging to what European Country?	Greece
20	1	The Alps are a mountain range on which continent?	Europe
21	1	The Andaman and Nicobar Islands in South East Asia are controlled by which country?	India
22	1	The Pyrenees mountains are located on the border of which two countries?	France and Spain
23	1	The Southeast Asian island of Borneo is politically divided among 3 countries.	True
24	1	The Svalbard Archipelago is a dependency of which country?	Norway
25	1	The White Cliffs of Dover is located in which country? 	United Kingdom
26	1	The mountainous Khyber Pass connects which of the two following countries?	Afghanistan and Pakistan
27	1	The prefix Sino- (As in Sino-American) is used to refer to what nationality?	Chinese
28	1	The surface area of Russia is slightly larger than that of the dwarf planet Pluto.	True
29	1	Vatican City, the smallest country in the world, is fully enclosed by which country?	Italy
30	1	What continent is the country Lesotho in?	Africa
31	1	What is Laos?	Country
32	1	What is the area of Vatican City?	0.44km^2
33	1	What is the capital city of Bermuda?	Hamilton
34	1	What is the capital city of the U.S. state of Texas?	Austin
35	1	What is the capital of Brazil?	Brasilia
36	1	What is the capital of Finland?	Helsinki
37	1	What is the capital of Peru?	Lima
38	1	What is the capital of Spain?	Madrid
39	1	What is the capital of the American state of Arizona?	Phoenix
40	1	What is the fifth largest country by area?	Brazil
41	1	What is the largest city and commercial capital of Sri Lanka?	Colombo
42	1	What is the largest country in the world ?	Russian Federation
43	1	What is the most populous Muslim-majority nation in 2010?	Indonesia
44	1	What is the name of New Zealand's indigenous people?	Maori
45	1	What is the name of rocky region that spans most of eastern Canada?	Canadian Shield
46	1	What is the official language in Liechtenstein?	German
47	1	What is the right way to spell the capital of Hungary?	Budapest
48	1	What is the tallest mountain in Canada?	Mount Logan
49	1	What is the world's smallest country by population?	Vatican City
50	1	What island in the Canary Islands was the scene of one of the worst air disasters in history with the collision of two jumbo jets?	Tenerife
51	1	What was the African nation of Zimbabwe formerly known as?	Rhodesia
52	1	Where is the city of Haarlem located?	The Netherlands
53	1	Which European city is known as the "City of Light"?	Paris
54	1	Which UK country features a dragon on their flag?	Wales
55	1	Which US state is nicknamed "The Golden State"?	California
56	1	Which city is the capital of Switzerland?	Bern
57	1	Which country has three capital cities?	South Africa
58	1	Which country inside the United Kingdom does NOT appear on its flag, the Union Jack?	Wales
59	1	Which country ranks first in the number of historically active volcanoes?	Indonesia
60	1	Which is not a country in Africa?	Guyana
61	1	Which languages does NOT use the Latin alphabet?	Georgian
62	1	Which of the following European languages is classified as a "language isolate?"	Basque
63	1	Which of the following Inuit languages was the FIRST to use a unique writing system not based on the Latin alphabet?	Inuktitut
64	1	Which of the following countries is within the Eurozone but outside of the Schengen Area?	Cyprus
65	1	Which of the following geographic features is a ring-shaped coral reef, island, or series of islets?	Atoll
66	1	Which of the following is NOT a capital city?	Sydney
67	1	Which of these countries is NOT a part of the Asian continent?	Suriname
68	1	Which of these country's capitals starts with the letter B?	Lebanon
69	1	Which of these is NOT a province in China?	Yangtze
70	1	Which of these is NOT a real tectonic plate?	Atlantic Plate
71	1	Which of these is NOT an Australian state or territory?	Alberta
72	2	"Rumble" by Link Wray is the only instrumental song to ever have been banned from US radio.	True
73	2	"The Simpsons" family is named after creator Matt Groening's real family.	True
74	2	"The first rule is: you don't talk about it" is a reference to which movie?	Fight Club
75	2	'I'm never gonna dance again, guilty feet have got no rhythm' were lyrics from which Wham! hit single?	Careless Whisper
76	2	A piccolo is a smaller version of what instrument?	Flute
77	2	After India, which country produces the second most movies per year?	Nigeria
78	2	Artis Leon Ivey Jr. is better known as which rap artist?	Coolio
79	2	At the end of the 2001 film "Rat Race", whose concert do the contestants crash?	Smash Mouth
80	2	Ellie Goulding's earliest album was named?	Lights
81	2	Grand Theft Autumn/Where Is Your Boy is a song by which band?	Fall Out Boy
82	2	How many semitones are in an octave?	12
83	2	In "Breaking Bad", Walter White is a high school teacher diagnosed with which form of cancer?	Lung Cancer
84	2	In "Breaking Bad," which main character was planned to be killed in Season 1 but wasn't because the show creator liked the actor?	Jesse Pinkman
85	2	In "The Hobbit," who was head of the White Council? 	Saruman
86	2	In Alfred Hitchcock's film 'Psycho' it is said he used chocolate syrup to simulate the blood in the famous shower scene from 	True
87	2	In August 1964, who introduced the Beatles to cannabis?	Bob Dylan
88	2	In Kendrick Lamar's 2012 album, "Good Kid, M.A.A.D City", the album's story takes place in which city?	Compton
89	2	In Star Wars, what's the name of the new Government created after the defeat of the Galactic Empire?	The New Republic
90	2	In the words of his 1973 song, Bob Dylan is "knock, knock, knockin" on which door?	Heaven's
91	2	In what year was the first Transformers movie released?	1986
92	2	In which 1955 film does Frank Sinatra play Nathan Detroit?	Guys and Dolls
93	2	Kanye West's "Gold Digger" featured which Oscar-winning actor?	Jamie Foxx
94	2	On the NBC show Community, whose catch-phrase was "Pop! Pop!"?	Magnitude
95	2	On which Beatles album would you find the song 'Eleanor Rigby'?	Revolver
96	2	Ozzy Osbourne was the lead singer for what metal band?	Black Sabbath
97	2	Samuel L. Jackson had the words, 'Bad Motherf*cker' in-scripted on his lightsaber during the filming of Star Wars.	True
98	2	Saul Hudson (Slash) of the band Guns N' Roses is known for playing what type of guitar?	Les Paul Standard
99	2	The 2002 film "28 Days Later" is mainly set in which European country?	United Kingdom
100	2	The Queen song `A Kind Of Magic` is featured in which 1986 film?	Highlander
101	2	The cover of The Beatles album "Abbey Road" featured a Volkswagen Beetle in the background.	True
102	2	This movie contains the quote, "Houston, we have a problem."	Apollo 13
103	2	What NBC sitcom once saw two of its characters try to pitch NBC on a sitcom about nothing?	Seinfeld
104	2	What episode of "Mr. Bean" saw him trying to prevent people from seeing him naked?	Mr. Bean in Room 426
105	2	What is the British term for a 64th note?	Hemidemisemiquaver
106	2	What is the name of the dog that played Toto in the 1939 film "The Wizard of Oz"?	Terry
107	2	What kind of instrument is a "Mandolin"?	String
108	2	What mutated animals act as monsters in the movie 'Night of the Lepus'?	Rabbits
109	2	What was the best selling album of 2015?	Adele, 25
110	2	What was the first James Bond film?	Dr. No
111	2	What was the name of the protagonist in the movie Commando (1985)?	John Matrix
112	2	What year did the James Cameron film "Titanic" come out in theaters?	1997
113	2	When was Gangnam Style uploaded to YouTube?	2012
114	2	Where did the British Boy Band "Bros" come from?	Camberley
115	2	Which Beatle led the way across the zebra crossing on the Abbey Road album cover?	John
116	2	Which actress portrayed Dr. Grace Augustine in the James Cameron movie "Avatar"?	Sigourney Weaver
117	2	Which boxing personality was one of the presenters in the 1999 revival of It's a Knockout?	Frank Bruno
118	2	Which chain restaurant increased sales after it was mentioned in the 2016 Beyonce song: "Formation"?	Red Lobster
119	2	Which character was played by Dustin Diamond in the sitcom 'Saved by the Bell'?	Screech
120	2	Which classical composer wrote the "Moonlight Sonata"?	Ludvig Van Beethoven
121	2	Which country does the YouTuber "SinowBeats" originate from?	Scotland
122	2	Which former boy-band star released hit solo single "Angels" in 1997?	Robbie Williams
123	2	Which iconic character is featured in movies such as "The Enforcer", "Sudden Impact", and "The Dead Pool"?	Dirty Harry
124	2	Which member of "The Beatles" narrated episodes of "Thomas the Tank Engine"?	Ringo Starr
125	2	Which of the Beatles band members is barefoot on the front cover of the 'Abbey Road' album?	Paul McCartney
126	2	Which of the following movies was not based on a book?	Citizen Kane
127	2	Which of these Queen songs were sampled for the baseline in Vanilla "Ice's Ice Ice Baby?"	Under Pressure
128	2	Which of these is NOT a name of an album released by American rapper Pitbull?	Welcome to Miami
129	2	Which of these is NOT an album released by The Beatles?	The Wall
130	2	Which of these is NOT the name of an album released by English singer-songwriter Adele?	12
131	2	Which one of these Pink Floyd albums were also a movie?	The Wall
132	2	Which song previously recorded by Elvis Presley was covered by UB40 with a reggae beat?	Can't Help Falling in Love
133	2	Which stand-up comedian voiced the talking parrot "Iago" in Disney's 1992 adaptation of Aladdin?	Gilbert Gottfried
134	2	Which term best describes the connection of two sections of a musical piece through a transitional passage?	Bridge
135	2	Which was the first of Alfred Hitchcock's movies to be filmed in colour?	Rope
136	2	Who directed the 2015 movie "The Revenant"?	Alejandro G. Inarritu
137	2	Who directed the movie "Alien"?	Ridley Scott
138	2	Who is the frontman of Muse?	Matt Bellamy
139	2	Who is the star of the AMC series Breaking Bad?	Walter White
140	2	Who performed the guitar solo on Michael Jackson's hit "Beat It"?	Eddie Van Halen
141	2	Who plays protagonist Ethan Hunt in the "Mission: Impossible" film-series?	Tom Cruise
142	2	Who starred in the film 1973 movie "Enter The Dragon"?	Bruce Lee
143	2	Who was walking like an Egyptian in 1981?	The Bangles
144	3	A collection of Sanskrit hymns and verses known as the Vedas are sacred texts in what religion?	Hinduism
145	3	According to legend, the ancient Greeks constructed a huge wooden model of which animal to gain entrance to Troy?	Horse
146	3	Between 1973 to 1990, what country was ruled by dictator Augusto Pinochet?	Chile
147	3	Brazil used to be an empire.	True
148	3	Despite being seperated into multiple countries, The Scandinavian countries are unified by all having the same monarch.	False
149	3	During what war did the "Cuban Missile Crisis" occur?	Cold War
150	3	How long did the Warsaw Uprising during World War II last?	63 Days
151	3	In 1547 who became the 1st Tsar of Russia	Ivan the Terrible
152	3	In France, a hunting license or a sport-shooting license is needed to purchase any firearm.	True
153	3	In World War I, what was the name of the alliance of Germany, Austria-Hungary, the Ottoman Empire, and Bulgaria?	The Central Powers
154	3	In World War ll, Great Britian used inflatable tanks on the ports of Great Britain to divert Hitler away from Normandy/D-day landing.	True
155	3	In what year did Neil Armstrong and Buzz Aldrin land on the moon?	1969
156	3	In what year did William the Conqueror take control of England?	1066
157	3	In what year did the Battle of Verdun take place?	1916
158	3	In which war did the atomic bombings of Hiroshima and Nagasaki occur?	World War II
159	3	List the following Iranic empires in chronological order:	Median, Achaemenid, Parthian, Sassanid
160	3	On which day did ARPANET suffer a 4 hour long network crash?	October 27, 1980
161	3	On which day did construction start on "The Pentagon", the headquarters for the United States Department of Defense?	September 11, 1941
162	3	One of the deadliest pandemics, the "Spanish Flu", killed off what percentage of the human world population at the time?	3 to 6 percent
163	3	The Arab Spring was a series of protests and rebellions that began in which of these Arab nations?	Tunisia
164	3	The Bohemian Revolt (1618-1620) started after Protestants in Prague did what to their Catholic Lords Regents?	Threw them out of a window
165	3	The Korean War started in what year?	1950
166	3	The Spitfire originated from a racing plane.	True
167	3	The Tsar Bomba, the most powerful nuclear bomb ever tested, had a yield of 50 megatons but theoretically had a maximum yield of how much?	100 Megatons
168	3	The catastrophic nuclear accident that occurred in Ukraine in 1986 occurred at which power plant?	Chernobyl
169	3	The creator of the Enigma Cypher and Machine was of what nationality?	German
170	3	The fraudelent doctor John R. Brinkley acummulated great fame and wealth in the early 1900s offering what service?	Goat testicles transplant
171	3	The ontological argument for the proof of God's existence is first attributed to whom?	Anselm of Canterbury
172	3	The term Luddite originally applied to disgruntled workers in which industry?	Textile
173	3	Toussaint Louverture led a successful slave revolt in which country?	Haiti
174	3	Under which name was Rodrigo Borgia made Pope?	Alexander VI
175	3	United States President John F. Kennedy was assassinated during his presidential motorcade in Atlanta, Georgia on November 22nd, 1963.	False
176	3	Vatican city is a full member of United Nations.	False
177	3	What are the first names of the first father and son pair that were both Prime Ministers of Canada?	Justin and Pierre
178	3	What battle was the longest in World War I, lasting approximately 303 days?	Battle of Verdun 
179	3	What did the first vending machines in the early 1880's dispense?	Post cards
180	3	What was Genghis Khan's real name?	Temujin
181	3	What was Manfred von Richthofen's nickname?	The Red Baron
182	3	What was Napoleon Bonaparte's name before he changed it?	Napoleone di Buonaparte
183	3	What was William Frederick Cody better known as?	Buffalo Bill
184	3	What was the capital of South Vietnam before the Vietnam War?	Saigon
185	3	What was the original name of New York City?	New Amsterdam
186	3	What was the total length of the Titanic?	882 ft | 268.8 m
187	3	What were the first states to break away from Yugoslavia?	Slovenia, Croatia
188	3	What year did World War II end?	1945
189	3	What year did the Battle of Agincourt take place?	1415
190	3	What year was the Italian firearms manufacturer Beretta founded?	1526
191	3	When did Lithuania declare independence from the Soviet Union?	March 11th, 1990
192	3	When did Spanish Peninsular War start?	1808
193	3	When did the Battle of the Bulge end?	January 25, 1945
194	3	Which Nation did NOT have a Colony in modern-day North America?	Portugal
195	3	Which U.S. President was in office when the Gulf War began?	George H. W. Bush
196	3	Which country was Josef Stalin born in?	Georgia
197	3	Which naval battle was considered the turning point of the Pacific Ocean Theater during World War 2?	Battle of Midway
198	3	Which of the following African countries was most successful in resisting colonization?	Ethiopia
199	3	Which of the following Pacific Islander countries is ruled by a constitutional monarchy?	Tonga
200	3	Which of the following ancient Near Eastern peoples still exists as a modern ethnic group?	Assyrians
201	3	Which of the following battles is often considered as marking the beginning of the fall of the Western Roman Empire?	Battle of Adrianople
202	3	Which of the following is not in the Indo-European language family?	Finnish
203	3	Which of the following snipers has the highest amount of confirmed kills?	Simo Hayha
204	3	Which of these facilities was not present on the Titanic?	Fainting room
205	3	Which of these is NOT one of Donald Trump's children?	Julius
206	3	Who assassinated President James A. Garfield?	Charles Guiteau
207	3	Who led France during the "Reign of Terror" ?	Maximilien Robespierre
208	3	Who was a military strategist in the Eastern Zhou period?	Sun Tzu
209	3	Who was the British Prime Minister at the outbreak of the Second World War in 1939?	Neville Chamberlain
210	3	Who was the British Prime Minister at the outbreak of the Second World War?	Neville Chamberlain
211	3	Who was the Prime Minister of Japan when Japan declared war on the US?	Hideki Tojo
212	3	Who was the first man to travel into outer space?	Yuri Gagarin
213	3	Who was the first president born in the independent United States?	Martin Van Buren
214	3	Who was the first prime minister of Canada?	John Macdonald
215	3	Who was the first ruler of Haiti after the country had gained its independence?	Jean-Jacques Dessalines
216	4	"Elementary, my dear Watson" is a phrase that is never truly said within the Conan Doyle books of Sherlock Holmes.	True
217	4	"Green Eggs And Ham" is a book by which author?	Dr. Seuss
218	4	"Green Eggs and Ham" consists of only 50 different words.	True
219	4	A minotaur is half human half what?	Bull
220	4	According to Bram Stoker's novel, in which British coastal town did Dracula come ashore?	Whitby
221	4	According to Japanese folklore, what is the favorite food of the Kappa.	Cucumbers
222	4	According to the Egyptian Myth of Osiris, who murdered Osiris?	Set
223	4	Albrecht Durer's birthplace and place of death were in...	Nurnberg
224	4	An Ankh is the Egyptian Hieroglyph for what?	Life
225	4	By what nickname is Jack Dawkins known in the Charles Dickens novel, 'Oliver Twist'?	The Artful Dodger
226	4	Harry Potter was born on July 31st, 1980.	True
227	4	Hera is god of...	Marriage
228	4	In Greek Mythology, who killed Achilles?	Paris
229	4	In Greek mythology, who is the god of wine?	Dionysus
230	4	In Romance of the Three Kingdoms, who was not a member of the Peach Garden Oath?	Zhao Yun
231	4	In most traditions, who was the wife of Zeus?	Hera
232	4	In the "Harry Potter" novels, what must a Hogwarts student do to enter the Ravenclaw Common Room?	Answer a riddle
233	4	In the "Harry Potter" series, what is Headmaster Dumbledore's full name?	Albus Percival Wulfric Brian Dumbledore
234	4	In the "The Hobbit", who kills Smaug?	Bard
235	4	In the Beatrix Potter books, what type of animal is Tommy Brock?	Badger
236	4	In the Greek Mythology, the Gorgon can turn those who behold her to stone.	True
237	4	In the Greek Mythology, the god of war is called Mars.	False
238	4	In the Harry Potter universe, who does Draco Malfoy end up marrying?	Astoria Greengrass
239	4	In the year 1818, novelist Mary Shelly is credited with writing a fiction novel and creating this infamous character.	Frankenstein's monster
240	4	In what Harry Potter book was a Horcrux first encountered?	The Chamber of Secrets
241	4	Janus was the Roman god of doorways and passageways.	True
242	4	Neptune's greek name was...	Poseidon
243	4	Rannamaari was a sea demon that haunted the people of the Maldives and had to be appeased monthly with the sacrifice of a virgin girl.	True
244	4	Skai is the Norse Goddess of skiing, mountains, winter and bowhunting.	True
245	4	Talos, the mythical giant bronze man, was the protector of which island?	Crete
246	4	The Maori hold that which island nation was founded by Kupe, who discovered it under a long white cloud?	New Zealand
247	4	The ancient Roman god of war was commonly known as which of the following?	Mars
248	4	The book "The Little Prince" was written by...	Antoine de Saint-Exupery
249	4	The greek god Poseidon was the god of what?	The Sea
250	4	The painting "The Starry Night" by Vincent van Gogh was part of which art movement?	Post-Impressionism
251	4	This Greek mythological figure is the god/goddess of battle strategy (among other things).	Athena
252	4	This play is generally considered to be the most adaptable of Shakespeare's works, and follows two "star-crossed lovers".	Romeo and Juliet
253	4	Under what pseudonym did Stephen King publish five novels between 1977 and 1984?	Richard Bachman
254	4	What is another name for La Gioconda / La Joconde?	The Mona Lisa
255	4	What is the fourth book of the Old Testament?	Numbers
256	4	What is the make and model of the tour vehicles in "Jurassic Park" (1990)?	1989 Toyota Land Cruiser
257	4	What is the name of the Greek god of peaceful deaths?	Thanatos
258	4	What is the name of the first human being in Norse mythology?	Ask
259	4	What is the name of the wildman that Gilgamesh befriends and goes on adventures with?	Enkidu
260	4	What nationality was the famous artist Pablo Picasso?	Spanish
261	4	What was the name of the Mysterious Island, in Jules Verne's "The Mysterious Island"?	Lincoln Island
262	4	What were Marcel Duchamp's readymades?	utilitarian objects elevated to the status of art
263	4	What year was the Mona Lisa finished?	1504
264	4	When was Salvador Dali's painting, "The Persistence of Memory," completed?	1931
265	4	Where does Stephen King's "IT" take place?	Derry, Maine
266	4	Which Greek sculptor designed the Athena Parthenos statue inside the Parthenon?	Phidias
267	4	Which Van Gogh painting depicts the view from his asylum in Saint-Remy-de-Provence in southern France?	The Starry Night
268	4	Which art movement was Pablo Picasso known for co-founding?	Cubism
269	4	Which artist is famous for cutting off his ear?	Vincent van Gogh
270	4	Which artist painted "The Treachery of Images," a painting of a pipe with the description "this is not a pipe"?	Magritte
271	4	Which famous book is sub-titled 'The Modern Prometheus'?	Frankenstein
272	4	Which of the following is not one of the Greek Fates?	Narcissus
273	4	Which of these Roman gods doesn't have a counterpart in Greek mythology?	Janus
274	4	Which of these books was NOT written by the Czech author Karel Capek?	Journey to the Center of the Earth
275	4	Which of these mythological creatures is said to be half-man and half-horse?	Centaur
276	4	Which one of these paintings is not by Caspar David Friedrich?	The Black Sea
277	4	Which time signature is commonly known as "Cut Time?"	2/2
278	4	Who is the Egyptian god of reproduction and lettuce?	Min
279	4	Who is the God Loki's son? 	Fenrir 
280	4	Who painted "The Scream"?	Edvard Munch
281	4	Who painted The Starry Night?	Vincent van Gogh
282	4	Who painted the Mona Lisa?	Leonardo da Vinci 
283	4	Who painted the biblical fresco The Creation of Adam?	Michelangelo
284	4	Who sculpted the statue of David?	Michelangelo
285	4	Who was the King of Gods in Ancient Greek mythology?	Zeus
286	4	Who was the only god from Greece who did not get a name change in Rome?	Apollo
287	5	"Kamea," the Gilbertese Islander word for dog, is derived from the English phrase "Come here!"	True
288	5	"Windows NT" is a monolithic kernel.	False
289	5	111,111,111 x 111,111,111 = 12,345,678,987,654,321	True
290	5	About what percentage of the Earth's surface is water? 	70%
291	5	An equilateral triangle always has every angle measuring 60.	True
292	5	Apple was on the verge of bankruptcy in 1997 and was saved by Microsoft	True
293	5	At what depth should you make a decompression stop, or safety stop, on a typical scuba dive?	15 Feet / 5 Meters
294	5	Automobiles produced by Tesla Motors operate on which form of energy?	Electricity
295	5	Cats have whiskers under their legs.	True
296	5	DHCP stands for Dynamic Host Configuration Port.	False
297	5	E = MC3	False
298	5	Finnish Lapphund dogs were used for herding reindeer.	True
299	5	Folic acid is the synthetic form of which vitamin?	Vitamin B
300	5	How many bytes are in a single Kibibyte?	1024
301	5	How many laws of thermodynamics are there?	Four
302	5	How many planets are in our Solar System?	Eight
303	5	How many sides does a pentagon have?	5
304	5	How many teeth does the average adult mouth have (except for wisdom teeth)?	32
305	5	How many zeros are there in a googol?	100
306	5	If you could fold a piece of paper in half 50 times, its' thickness will be 3/4th the distance from the Earth to the Sun.	True
307	5	If you dip a dry towel into a tub full of water, water will climb up the towel by a phenomenon called "Cartillary Action"	False
308	5	In "Hexadecimal", what color would be displayed from the color code? "#00FF00"?	Green
309	5	In 2016, the IUCN reclassified the status of Giant Pandas from endangered to vulnerable.	True
310	5	In HTML, which non-standard tag used to be be used to make elements scroll across the viewport?	<marquee></marquee>
311	5	In computing, what does MIDI stand for?	Musical Instrument Digital Interface
312	5	Like with the Neanderthals, Homo sapiens sapiens also interbred with the Denisovans.	True
