346	5	The Windows 7 operating system has six main editions.	True
347	5	The common software-programming acronym "I18N" comes from the term "Interlocalization".	False
348	5	The decimal number 31 in hexadecimal would be what?	1F
349	5	The dish Fugu, is made from what family of fish?	Pufferfish
350	5	The echidna is a monotreme.	True
351	5	The first dual-core CPU was the Intel Pentium D.	False
352	5	The human heart has how many chambers?	4
353	5	The name of technology company HP stands for what?	Hewlett-Packard
354	5	What car manufacturer gave away their patent for the seat-belt in the interest of saving lives?	Volvo
355	5	What cell organelle is known as "the powerhouse of the cell?"	Mitochondria
356	5	What country was the Trabant 601 manufactured in?	East Germany
357	5	What does "hippopotamus" mean and in what langauge?	River Horse (Greek)
358	5	What five letter word is the motto of the IBM Computer company?	Think
359	5	What internet protocol was documented in RFC 1459?	IRC
360	5	What is radiation measured in?	Gray 
361	5	What is the "powerhouse" of the Eukaryotic animal cell?	Mitochondria
362	5	What is the area of a circle with a diameter of 20 inches if = 3.1415?	314.15 Inches
363	5	What is the average lifespan of a domestic rabbit?	8-12 years
364	5	What is the derivative of Acceleration with respect to time?	Jerk
365	5	What is the first Mersenne prime exponent over 1000?	1279
366	5	What is the fourth digit of ?	1
367	5	What is the hottest planet in the Solar System?	Venus
368	5	What is the mathematical formula of Ohm's law?	V = I*R
369	5	What is the name given to layer 4 of the Open Systems Interconnection (ISO) model?	Transport
370	5	What is the name of the default theme that is installed with Windows XP?	Luna
371	5	What is the only Millennium Prize Problem that has been solved so far?	Poincare conjecture
372	5	What is the powerhouse of the cell?	Mitochondria
373	5	What is the speed of light in a vacuum?	299,792,458 m/s
374	5	What scientific suborder does the family Hyaenidae belong to?	Feliformia
375	5	What type of creature is a Bonobo?	Ape
376	5	What type of function is x2+2x+1?	Quadratic
377	5	What was the name of the Ethiopian Wolf before they knew it was related to wolves?	Simien Jackel
378	5	What's the square root of 49?	7
379	5	Which Variable Valve Timing technology is used by BMW?	VANOS
380	5	Which car tire manufacturer is famous for its "P Zero" line?	Pirelli
381	5	Which class of animals are newts members of?	Amphibian
382	5	Which company was established on April 1st, 1976 by Steve Jobs, Steve Wozniak and Ronald Wayne?	Apple
383	5	Which internet company began life as an online bookstore called 'Cadabra'?	Amazon
384	5	Which is the longest bone in the human body? 	Femur
385	5	Which of the following cellular device companies is NOT headquartered in Asia?	Nokia
386	5	Which of the following is NOT a Russian car manufacturer?	BYD
387	5	Which of the following is NOT a passive electrical component?	Transistor
388	5	Which of the following liquids is least viscous? Assume temperature is 25C.	Acetone
389	5	Which of these companies does NOT manufacture motorcycles?	Toyota
390	5	Which of these is NOT a bone found in the human arm?	Tibia
391	5	Which planet did the "Viking 1" spacecraft send surface images of, starting in 1976?	Mars
392	5	Who is the original author of the realtime physics engine called PhysX?	NovodeX
393	5	Who patented a steam engine that produced continuous rotary motion?	James Watt
394	6	"Stadium of Light" is the home stadium for which soccer team?	Sunderland FC
395	6	At which bridge does the annual Oxford and Cambridge boat race start?	Putney
396	6	Edson Arantes do Nascimento is the full name of which legendary football player?	Pele
397	6	Etihad Stadium is the home stadium for which team?	Manchester City
398	6	Hockey player Wayne Gretzky was born in what Canadian province?	Ontario
399	6	How many French Open's did Bjorn Borg win?	6
400	6	In Canadian football, scoring a rouge is worth how many points?	1
401	6	In Rugby League, performing a "40-20" is punished by a free kick for the opposing team.	False
402	6	In a game of snooker, what colour ball is worth 3 points?	Green
403	6	In bowling, what is the term used for getting three consecutive strikes?	Turkey
404	6	In golf, what name is given to a hole score of two under par?	Eagle
405	6	In what country were the 2014 Winter Olympics held in the town of Sochi?	Russia
406	6	In what sport is a "shuttlecock" used?	Badminton
407	6	Prior to 2018, which car company is the only Japanese company which won the 24 Hours of Le Mans?	Mazda
408	6	Roger Federer is a famous soccer player.	False
409	6	Shaquille O'Neal has only made one three pointer in his career.	True
410	6	Soccer player Cristiano Ronaldo opened a museum dedicated to himself.	True
411	6	The AHL affiliate team of the Boston Bruins is named what?	Providence Bruins
412	6	The F1 season of 1994 is remembered for what tragic event?	Death of Ayrton Senna (San Marino)
413	6	The Los Angeles Dodgers were originally from what U.S. city?	Brooklyn
414	6	The Mazda 787B won the 24 Hours of Le Mans in what year?	1991
415	6	The Olympics tennis court is a giant green screen.	True
416	6	The song "Three Lions" by the Lightning Seeds was made for which major football event in 1996?	European Championships
417	6	There are a total of 20 races in Formula One 2016 season.	False
418	6	What country hosted the 2014 Winter Olympics?	Russia
419	6	What is Tiger Woods' all-time best career golf-score?	61
420	6	What is the full name of the footballer "Cristiano Ronaldo"?	Cristiano Ronaldo dos Santos Aveiro
421	6	What is the most common type of pitch thrown by pitchers in baseball?	Fastball
422	6	What is the name of Manchester United's home stadium?	Old Trafford
423	6	What is "The Sport of Kings"?	Horse Racing
424	6	What national team won the first UEFA Nations League?	Portugal
425	6	What sport features the terms love, deuce, match and volley?	Tennis
426	6	What team did England beat in the semi-final stage to win in the 1966 World Cup final?	Portugal
427	6	What team did England beat to win in the 1966 World Cup final?	West Germany
428	6	What tool lends it's name to a last-stone advantage in an end in Curling?	Hammer
429	6	What was Sir Donald Bradman's batting average in test matches?	99.94
430	6	What was the year of estabilishment of the Bari Italian Football Club?	1908
431	6	When was the first official international game played?	1872
432	6	Which African American is in part responsible for integrating  Major League baseball?	Jackie Robinson
433	6	Which English football club has the nickname 'The Foxes'?	Leicester City
434	6	Which Formula 1 driver switched teams in the middle of the 2017 season?	Carlos Sainz Jr.
435	6	Which Formula One driver was nicknamed 'The Professor'?	Alain Prost
436	6	Which boxer was banned for taking a bite out of Evander Holyfield's ear in 1997?	Mike Tyson
437	6	Which car manufacturer won the 2016 24 Hours of Le Mans?	Porsche
438	6	Which country hosted the 2018 FIFA World Cup?	Russia
439	6	Which country hosted the 2020 Summer Olympics?	Japan
440	6	Which country hosted the 2022 FIFA World Cup?	Qatar
441	6	Which country produced football players such as Cafu, Roberto Carlos and Pele?	Brazil
442	6	Which country won the 2018 FIFA World Cup hosted in Russia?	France
443	6	Which darts player has won the most World Championship titles?	Phil Taylor
444	6	Which driver has been the Formula 1 world champion for a record 7 times?	Michael Schumacher
445	6	Which is Kenesisa Bekele's personal best at marathon?	2:01:41
446	6	Which nation hosted the FIFA World Cup in 2006?	Germany
447	6	Which of the following Grand Slam tennis tournaments occurs LAST?	US Open
448	6	Which of the following player scored a hat-trick during their Manchester United debut?	Wayne Rooney
449	6	Which of the following sports is not part of the triathlon?	Horse-Riding
450	6	Which of these English football clubs is based in Liverpool?	Everton
451	6	Which of these jersey numbers has Shaquille O'Neal never worn?	35
452	6	Which of these teams has Jaromir Jagr not played for?	New York Islanders
453	6	Which of these track-and-field events is NOT included in the Olympic men's decathlon?	Hammer throw
454	6	Which player "kung-fu kicked" a Crystal Palace fan in January 1995?	Eric Cantona
455	6	Which portuguese island is soccer player Cristiano Ronaldo from?	Madeira
456	6	Which soccer team won the Copa America 2015 Championship ?	Chile
457	6	Which team won 2014 FIFA World Cup in Brazil?	Germany
458	6	Which year did Jenson Button won his first ever Formula One World Drivers' Championship?	2009
459	6	Who did Steven Gerrard win the Champions League with?	Liverpool
460	6	Who has played the most tournaments on the Brazilian national soccer team?	Cafu
461	6	Who was the top scorer of the 2014 FIFA World Cup?	James Rodriguez
462	6	Who was the topscorer for England national football team?	Wayne Rooney
463	6	Who won the "Champions League" in 1999?	Manchester United
464	6	Who won the 1994 San Marino Grand Prix, the race in which Ayrton Senna was killed?	Michael Schumacher
465	6	Who won the 1998 Daytona 500?	Dale Earnhardt
466	6	Who won the 2016 Formula 1 World Driver's Championship?	Nico Rosberg
467	6	Who won the 2017 Formula One World Drivers' Championship?	Lewis Hamilton
468	6	Who won the 2018 Monaco Grand Prix?	Daniel Ricciardo
469	6	Who won the UEFA Champions League in 2016?	Real Madrid C.F.
470	6	Who won the UEFA Champions League in 2017?	Real Madrid C.F.
471	7	"Nephelococcygia" is the practice of doing what? 	Finding shapes in clouds
472	7	"Santa Claus" is a variety of melon.	True
473	7	A pasodoble is a type of Italian pasta sauce.	False
474	7	Albert Einstein had trouble with mathematics when he was in school.	False
475	7	Bob and Mike Bryan were well known brothers in which sport?	Tennis
476	7	Coleslaw originated from which European country?	The Netherlands
477	7	De Eemhof, Port Zelande and Het Heijderbos are holiday villas owned by what company?	Center Parcs
478	7	Ecuador uses the Mexican Peso as its currency.	False
479	7	Fast food restaurant chains Carl's Jr. and Hardee's are owned by the same company.	True
480	7	Foie gras is a French delicacy typically made from what part of a duck or goose?	Liver
481	7	Gouda cheese is from which European country?	The Netherlands
482	7	Haggis is traditionally ate on Burns Night.	True
483	7	How many colors are there in a rainbow?	7
484	7	How many furlongs are there in a mile?	Eight
485	7	How many letters are there in the English alphabet?	26
486	7	How tall is the Burj Khalifa?	2,722 ft
487	7	If someone said "you are olid", what would they mean?	You smell extremely unpleasant.
488	7	If you are caught "Goldbricking", what are you doing wrong?	Slacking
489	7	If you planted the seeds of Quercus robur, what would grow?	Trees
490	7	In 2013 how much money was lost by Nigerian scams?	$12.7 Billion
491	7	In a standard Gregorian calendar, how many months begin with the letter 'J'?	Three
492	7	In the English language, what is the name of the "&" character?	Ampersand
493	7	In what year did Canada stop producing the penny?	2012
494	7	Is a dog a mammal?	True
495	7	Kraft "Cheez Whiz" contains cheese culture, but doesn't actually contain cheese	True
496	7	Named after the mallow flower, mauve is a shade of what?	Purple
497	7	Only 9% of US Households owned a television in 	1950
498	7	Out of these four buildings, which one is the tallest, with a height of 1,483 ft (451.9 m)?	Petronas Twin Towers, Malaysia
499	7	Pluto is a planet.	False
500	7	Red Vines is a brand of what type of candy?	Licorice
501	7	Terry Gilliam was an animator that worked with which British comedy group?	Monty Python
502	7	The French word to travel is "Travail"	False
503	7	The Happy Face was created by commercial artist Harvey Ball.	True
504	7	The Mexican Beer "Corona" is what type of beer?	Pale Lager
505	7	The New York Subway is the oldest underground in the world.	False
506	7	The Original Jack-o-Lanterns were actually hollowed out turnips.	True
507	7	The mitochondria is the powerhouse of the cell.	True
508	7	The word "abulia" means which of the following?	The inability to make decisions
509	7	The word "astasia" means which of the following?	The inability to stand up
510	7	The word "dozen" usually refers to a group of how many objects?	12
511	7	The words "bungalow" and "shampoo" originate from the languages of which country?	India
512	7	This field is sometimes known as "The Dismal Science."	Economics
513	7	This is the correct spelling of "Supercalifragilisticexpialidocious".	True
514	7	To which language family does Kazakh belong?	Turkic
515	7	What alcoholic drink is made from molasses?	Rum
516	7	What do sailors call the front of a boat?	Bow
517	7	What do sailors call the right side of a boat?	Starboard
518	7	What fast food chain has the most locations globally? 	Subway
519	7	What is Cynophobia the fear of?	Dogs
520	7	What is H2O?	Water
521	7	What is Tasmania?	An Australian State
522	7	What is on display in the Madame Tussaud's museum in London?	Wax sculptures
523	7	What is the Portuguese word for "Brazil"?	Brasil
524	7	What is the famous Papa John's last name?	Schnatter
525	7	What is the largest organ of the human body?	Skin
526	7	What is the most frequently used letter in the english alphabet?	E
527	7	What is the name of the Jewish New Year?	Rosh Hashanah
528	7	What is the nickname of the US state of California?	Golden State
529	7	What is the romanized Japanese word for "university"?	Daigaku
530	7	What is the shape of the toy invented by Hungarian professor Erno Rubik?	Cube
531	7	What machine element is located in the center of fidget spinners?	Bearings
532	7	What nation produces roughly 40% of the world's vanilla?	Madagascar
533	7	When one is "envious", they are said to be what color?	Green
534	7	When someone is cowardly, they are said to have what color belly?	Yellow
535	7	When you cry in space, your tears stick to your face.	True
536	7	Where in La Coruna (Spain) is the headquarters of "Inditex", the biggest fashion group in the world?	Arteijo
537	7	Which American-owned brewery led the country in sales by volume in 2015?	D. G. Yuengling and Son, Inc
538	7	Which country has the Union Jack in its flag?	New Zealand
539	7	Which is the most popular spoken language in the Southern Hemisphere?	Portuguese
540	7	Which mountain has the highest peak in Australia?	Mount Kosciuszko, New South Wales
541	7	Which of the following is the IATA code for Manchester Airport?	MAN
542	7	Which of the following nations was NOT a belligerent in World War I?	Denmark
543	7	Which of these American singers and songwriters won a Nobel Prize in Literature?	Bob Dylan
544	7	Which of these banks are NOT authorized to issue currency notes in Hong Kong?	OCBC
545	7	Which of these companies does NOT manufacture automobiles?	Ducati
546	7	Which of these is NOT considered to be a colour that makes up the rainbow?	Pink
547	7	Which slogan did the fast food company, McDonald's, use before their "I'm Lovin' It" slogan?	We Love to See You Smile
548	7	Which type of cutlery is most suited for eating soup?	Spoon
549	7	Who played General Aladeen in The Dictator?	Sacha Baron Cohen
550	7	Xanthophobia is the fear of what color?	Yellow
