822	5	Que significa el nombre cientifico de la criatura marina del Periodo Cambrico Anomalocaris?	Camaron Anormal
823	5	Que significan las siglas MIME en informatica?	Extensiones Multiproposito del Correo de Internet
824	5	Que es "Stenoma"?	Un genero de polillas
825	5	Que es el "Mitsubishi Wakamaru"?	Un robot
826	5	Cual es el numero romano para 500?	D
827	5	Cual es la unidad SI de resistencia?	Ohmios
828	5	Cual es la representacion alfanumerica del numero imaginario?	yo
829	5	Cual es el nombre de codigo del sistema operativo movil Android 7.0?	Turron
830	5	Cual es el nombre comun del compuesto quimico "monoxido de dihidrogeno"?	Agua
831	5	Cual es el orden correcto de operaciones para resolver ecuaciones?	Parentesis, Exponentes, Multiplicacion, Division, Suma, Resta
832	5	Cual es la derivada de la Aceleracion con respecto al tiempo?	Imbecil
833	5	Cual es el auto de carretera mas rapido del mundo?	Koenigsegg Agera RS
834	5	Cual es la vida media del Uranio-235?	703.800.000 anos
835	5	Cual es el organismo viviente mas grande conocido actualmente por el hombre?	Hongo de la Miel
836	5	Cual es el termino medico para el nivel bajo de azucar en la sangre?	Hipoglucemia
837	5	Cual es la toxina mas potente conocida?	Toxina botulinica
838	5	Cual es la empresa paralela mas significativa que ha perseguido la popular compania de armas de fuego, Remington?	Maquinas de escribir
839	5	Cual es el ave nacional de Bahrein?	Bulbul
840	5	Cual es el nombre cientifico del "Oso Polar"?	Ursus Maritimus
841	5	Cual es el nombre cientifico del Aguila Calva?	Aguila Calva
842	5	Cual es el numero mas pequeno que puede expresarse como la suma de dos cubos positivos de dos formas diferentes?	1729
843	5	Cual es la unidad SI estandar para el tiempo?	Segundo
844	5	Cual es el peso atomico estandar de un nucleo de Plutonio?	doscientos cuarenta y cuatro
845	5	Cual es la unidad de resistencia electrica?	Ohmio
846	5	Que tipo de tren era Stepney, un tren en el Bluebell Railway notable por su aparicion en "The Railway Series"?	LB&SCR A1X
847	5	Que lenguaje utiliza Node.js?	JavaScript
848	5	Que produce el color verde de la mayoria de las hojas de las plantas?	Clorofila
849	5	Cual fue el primer vehiculo que incluyo aire acondicionado como equipo de fabrica estandar?	Packard
850	5	Cual fue el nombre de la vulnerabilidad de seguridad encontrada en Bash en 2014?	Shellshock
851	5	Cuando BMW fue establecida en 1916, estaba produciendo automoviles.	Falso
852	5	Cuando se lanzo la mascota digital Tamagotchi?	1996
853	5	Cuando se lanzo el iPhone?	2007
854	5	Donde se fabrican los automoviles de la marca "Ferrari"?	Italia
855	5	De donde se origino la raza de perro "Chihuahua"?	Mexico
856	5	Que empresa japonesa es el mayor fabricante mundial de motocicletas?	Honda
857	5	Que tipo de matriz RAID esta asociado con el espejo de datos?	RAID 1
858	5	Cual es la palabra clave SQL que se utiliza para obtener datos de una base de datos?	SELECCIONAR
859	5	Que animal fue parte de un experimento de domesticacion ruso en 1959?	Zorros
860	5	Que fabricante de automoviles creo el "Aventador"?	Lamborghini
861	5	A que clase de animales pertenecen los tritones?	Anfibio
862	5	Cual fue el lenguaje de programacion #1 en terminos de uso en GitHub en 2015?	JavaScript
863	5	Que consola de videojuegos es desarrollada por Sony?	PlayStation
864	5	Que matematico griego corrio desnudo por las calles de Siracusa gritando "Eureka!" despues de descubrir el principio del desplazamiento?	Arquimedes
865	5	Que horizonte en un perfil de suelo consiste en roca madre?	R
866	5	Cual no es un tipo de neurona?	Neurona Sensorial
867	5	Cual es el elemento mas abundante en el universo?	Hidrogeno
868	5	Cual de los siguientes se considera condicionamiento clasico?	Los experimentos del perro de Pavlov
869	5	Cual de los siguientes plasticos se usa comunmente para marcos de ventanas, canaletas y tuberias de drenaje?	Policloruro de vinilo (PVC)
870	5	Cual de las siguientes naves espaciales nunca toco la luna?	Mariner 4
871	5	Cual de los siguientes vehiculos presentaba un techo completamente de cristal en el modelo base?	Renault Avantime
872	5	Cual de estos elementos es un metaloide?	Antimonio
873	5	Cual de estos elementos en la Tabla Periodica es un Gas Noble?	Neon
874	5	Cual de estos es un codon de parada en el ADN?	TAA
875	5	Cual de estos se utiliza para demostrar que la Tierra gira sobre su eje?	Pendulo de Foucault
876	5	Cual de estos lenguajes de programacion es un lenguaje de bajo nivel?	Asamblea
877	5	Cual de estas especies no esta extinta?	dragon de Komodo
878	5	Cual de estos es el termino cientifico para "Brain Freeze"?	Neuralgia del ganglio esfenopalatino
879	5	Que lenguaje de programacion fue desarrollado por Sun Microsystems en 1995?	Java
880	5	Cual es la unidad cientifica que lleva el nombre de un noble italiano?	Voltio
881	5	Que tipo de roca se crea por intenso calor Y presion?	Metamorfico
882	5	Quien es el fundador de Palantir?	Peter Thiel
883	5	El factorial de cero es igual a cero.	Falso
884	6	El tenis de ATP organizo varios torneos en cancha de cesped sintetico antes de ser reemplazados para reducir lesiones.	Verdadero
885	6	Cuantos jugadores de futbol deben estar en el campo al mismo tiempo?	22
886	6	En 2016, quien gano el Campeonato Mundial de Constructores de Formula 1 por tercera vez consecutiva?	Mercedes-AMG Petronas
887	6	En el futbol asociacion, o futbol, un corner es cuando el juego se reanuda despues de que alguien marca un gol.	Falso
888	6	En golf, que nombre se le da a un hoyo con una puntuacion de dos bajo par?	Aguila
889	6	El skateboarding fue incluido en los Juegos Olimpicos de Verano de 2020 en Tokio.	Verdadero
890	6	El tenis fue una vez conocido como Racquetball.	Falso
891	6	La temporada de Formula 1 de 1988 tuvo a McLaren ganando todas las carreras excepto una, que carrera no ganaron?	Gran Premio de Italia
892	6	Que termino del cricket denota que un bateador es eliminado con una puntuacion de cero?	Pato
893	6	Cual es el nombre de la filial de la AHL de los Toronto Maple Leafs?	Marlies de Toronto
894	6	Cual es el equipo mas antiguo de las Grandes Ligas de Beisbol?	Atlanta Bravos
895	6	Que equipo nacional gano la primera UEFA Nations League?	Portugal
896	6	A que equipo vencio Inglaterra en la semifinal para ganar la final de la Copa Mundial de 1966?	Portugal
897	6	Que equipo gano la Copa MLS 2016?	Seattle Sounders
898	6	Que piloto de Formula 1 cambio de equipo a mitad de la temporada 2017?	Carlos Sainz Jr.
899	6	Que futbolista italiano le dijo a Neuer donde iba a poner su disparo y lo saco afuera, durante el partido Italia-Alemania, UEFA EURO 2016?	Pelle
900	6	Que fabricante de automoviles gano las 24 Horas de Le Mans de 2017?	Porsche
901	6	Que ciudad tiene todos los uniformes de sus equipos deportivos profesionales con el mismo esquema de colores?	Pittsburgh
902	6	Cual de los siguientes deportes no forma parte del triatlon?	Equitacion
903	6	Cual de estos jugadores de la NHL nunca ha ganado un Trofeo Hart por MVP de la Temporada Regular?	Steve Yzerman
904	6	Cual de estos equipos no es miembro de la era "Original Six" de la NHL?	Filadelfia Flyers
905	6	Que equipo ha ganado la mayoria de las Stanley Cups en la NHL?	Canadienses de Montreal
906	6	Que equipo gano la Copa Mundial de la FIFA 2014 en Brasil?	Alemania
907	6	Quien gano la Stanley Cup de 2011?	Boston Bruins
908	6	Quien gano el Campeonato Nacional de la College Football Playoff (CFP) 2015?	Ohio State Buckeyes
909	6	Quien gano la Liga de Campeones de la UEFA en 2017?	Real Madrid Club de Futbol
910	7	Cual es el elemento quimico, numero 11 en la Tabla Periodica, que tiene el simbolo Na?	Sodio
911	7	"Ananas" se usa mayormente como la palabra para pina en otros idiomas.	Verdadero
912	7	"Goma arabiga" es una goma natural que consiste en la savia endurecida de que especie de arbol?	Acacia
913	7	En que museo de Londres se encuentra una estatua de Charles Darwin?	Museo de Historia Natural
914	7	Segun Fair Works Australia, cuanto tiempo tienes que trabajar para obtener Licencia por Antiguedad?	7 anos
915	7	Segun el Libro del Genesis en el Antiguo Testamento, cuantos dias le tomo a Dios crear el mundo?	Seis
916	7	Segun los CDC de Estados Unidos, uno de cada cuantos estadounidenses muere anualmente debido al fumar?	Cinco
917	7	Adolf Hitler nacio en Australia.	Falso
918	7	De que tipo de cancer murio Steve Jobs, cofundador de Apple, por complicaciones?	Pancreatico
919	7	En que estado de EE.UU. se encuentra el Area 51?	Nevada
920	7	Chartreuse es un color entre amarillo y que?	Verde
921	7	El frances es un idioma oficial en Canada.	Verdadero
922	7	Haggis se come tradicionalmente en la Noche de Burns.	Verdadero
923	7	Cuantos colores hay en un arcoiris?	7
924	7	Cuantos furlongs hay en una milla?	Ocho
925	7	Cuantas letras hay en el alfabeto ingles?	veintiseis
926	7	Si plantaras las semillas de Quercus robur, que creceria?	Arboles
927	7	En "Battle Cats", cual es la tasa de porcentaje critico de Moneko / MISS Moneko?	15%
928	7	En una baraja estandar de cartas, cual es el unico rey sin bigote?	Corazones
929	7	En aerodinamica, que fuerza empuja un objeto hacia arriba?	Ascensor
930	7	En el universo ficticio de SCP, que "Clase de Objeto" se asigna a los SCP que no pueden ser contenidos?	Apolion
931	7	En la franquicia de videojuegos Kingdom Hearts, el protagonista principal lleva un arma con que forma?	Clave
932	7	En que ano Canada dejo de producir el centavo?	2012
933	7	En que ano Ghana obtuvo su independencia?	1957
934	7	Las papas instantaneas fueron inventadas por el canadiense Edward Asselbergs en 1962.	Verdadero
935	7	Kraft "Cheez Whiz" contiene cultivo de queso, pero en realidad no contiene queso	Verdadero
936	7	Linus Pauling, uno de los unicos ganadores de multiples Premios Nobel, gano sus Premios Nobel en Quimica y en que?	Paz
937	7	Macintosh ha nombrado seis de sus sistemas operativos despues de felinos grandes. Que felino grande nombro Macintosh su lanzamiento de 2007?	Leopardo
938	7	Nutella es producida por la empresa alemana Ferrero.	Falso
939	7	En promedio, al menos 1 persona es asesinada por un conductor ebrio en los Estados Unidos cada hora.	Verdadero
940	7	El Tenis de Mesa se origino en Inglaterra	Verdadero
941	7	Pluton es un planeta.	Falso
942	7	Red Vines es una marca de que tipo de caramelo?	Regaliz
943	7	Samhainofobia es el termino utilizado para un miedo anormal y persistente a Halloween.	Verdadero
944	7	Sciophobia es el miedo a que?	Sombras
945	7	Terry Gilliam fue un animador que trabajo con que grupo de comedia britanico?	Monty Python
946	7	La organizacion britanica CAMRA significa The Campaign for Real Ale.	Verdadero
947	7	La Medalla Fields, uno de los premios mas codiciados en matematicas, se otorga cada cuantos anos?	4
948	7	La palabra francesa para "glass" es "glace".	Falso
949	7	La palabra francesa para viajar es "Travail"	Falso
950	7	La Gran Muralla China es visible desde la luna.	Falso
951	7	El animal nacional de Escocia es el Unicornio.	Verdadero
952	7	El Coran es el libro sagrado de cual religion abrahimica?	Islam
953	7	Que significa la palabra sueca "Grunka" en ingles?	Cosa
954	7	El bikini recibe su nombre del "Atolon de Bikini", una isla donde los Estados Unidos realizo pruebas de bombas atomicas.	Verdadero
955	7	El canal comercial britanico ITV significa "International Television".	Falso
956	7	La frase "accidente esperando suceder" es un ejemplo de que tipo de figura literaria?	Modismo
957	7	La palabra "abulia" significa cual de lo siguiente?	La incapacidad de tomar decisiones
958	7	Las palabras "bungalow" y "shampoo" se originan en los idiomas de que pais?	India
959	7	Virgin Trains, Virgin Atlantic y Virgin Racing son companias que pertenecen a que famoso empresario?	Richard Branson
960	7	Que cofundador de la empresa de realidad virtual Oculus VR murio en un accidente automovilistico en 2013?	Andrew Scott Reisse
961	7	En que juego fue la primera aparicion de Waluigi?	Mario Tennis 64 (N64)
962	7	Que aerolinea era propietaria del avion que se estrello frente a la costa de Nueva Escocia en 1998?	Linea Aerea Suiza
963	7	Que empresa es propietaria de Outlook?	Microsoft
964	7	Como llaman los marineros a la proa de un barco?	Proa
965	7	Que significa la F en el FBI?	Federal
966	7	Que es el "dabbing"?	Un baile
967	7	Que es un Burgee?	Una bandera
968	7	Cual es la palabra francesa para "hat"?	Sombrero
969	7	Cual es la palabra alemana para "cuchara"?	I notice you've provided a German word (Loffel = spoon) rather than an English word. Could you please provide an English trivia question or answer to translate to Spanish?
970	7	Cual es la palabra portuguesa para "Brasil"?	Brasil
971	7	Cual es la palabra en espanol para "burro"?	Burro
972	7	Cual es la esperanza de vida promedio de una hormiga de jardin?	15 anos
973	7	Cual es el primer libro del Antiguo Testamento?	Genesis
974	7	Cual es el sistema de transito rapido mas grande del mundo por numero de estaciones, con 472 estaciones en operacion?	Metro de Nueva York
975	7	Cual es el puente mas largo del mundo?	Puente Gran Danyang-Kunshan, China
976	7	Cual es el nombre de Polonia en polaco?	Polonia
977	7	Cual es el nombre del grupo antagonista en Danganronpa Another Episode: Ultra Despair Girls?	Guerreros de Esperanza
978	7	Cual es el nombre de la mano de poker que contiene tres de una clase y un par?	Casa llena
979	7	Cual es la palabra japonesa romanizada para "universidad"?	Daigaku
980	7	Cual es la forma del juguete inventado por el profesor hungaro Erno Rubik?	Cubo
981	7	Cual es la unidad de moneda en Laos?	Kip
982	7	Que nombre representa la letra "M" en el alfabeto fonetico de la OTAN?	Miguel
983	7	Cual era el nombre original del motor de busqueda "Google"?	BackRub
984	7	En que ano nacio Walt Disney?	1901
985	7	Cuando se introdujo Hubba Bubba por primera vez?	1979
986	7	Cuando se lanzo la PlayStation 3?	11 de noviembre de 2006
987	7	Cuando lloras en el espacio, tus lagrimas se adhieren a tu cara.	Verdadero
988	7	Cual fue la ametralladora ligera fabricada en Estados Unidos que era informalmente conocida por los soldados estadounidenses que la utilizaban como "Grease Gun"?	M3
989	7	Que montana tiene el pico mas alto de Australia?	Monte Kosciuszko, Nueva Gales del Sur
990	7	Cual de los siguientes describe correctamente el orden de palabras en japones?	Sujeto Objeto Verbo
991	7	Cual de los siguientes NO es una de las fabulas de Esopo?	El zorro y el sabueso
992	7	Cual de los siguientes idiomas NO utiliza el genero como parte de su gramatica?	Turco
993	7	Cual de estos no es un diseno tipico de espada europea?	Cimitarra
994	7	Cual es el signo del zodiaco representado por el Cangrejo?	Cancer
995	7	Que tipo de cubierto es mas adecuado para comer sopa?	Cuchara
996	7	Quien invento la primera barra de chocolate, en 1847?	Joseph Fry
997	7	Quien interpreto al General Aladeen en The Dictator?	Sacha Baron Cohen
998	7	Esta permitido vender tu alma en eBay.	Falso
999	7	Puedes beber alcohol legalmente mientras conduces en Misisipi.	Verdadero
