0	1	Que ciudad de Texas tiene el apodo de "La Rosa Amarilla de Texas"?	Amarillo
1	1	Africa es un pais.	Falso
2	1	Alaska es el estado mas grande de los Estados Unidos.	Verdadero
3	1	La Antartida es el desierto mas grande del mundo.	Verdadero
4	1	Donde se encuentra el Paso de Colchester, tambien conocido como "Puente del Hombre Conejero"?	Condado de Fairfax, Virginia
5	1	Colombia recibe su nombre de Cristobal Colon.	Verdadero
6	1	Frankenmuth, una ciudad estadounidense apodada "Pequena Baviera", se encuentra en que estado?	Michigan
7	1	Groenlandia es casi tan grande como Africa.	Falso
8	1	Cuantos paises hay dentro del Reino Unido?	Cuatro
9	1	Cuantos paises son mas grandes que Australia?	5
10	1	Cuantos paises bordean Kirguistan?	Cuatro
11	1	Cuantos paises comparten frontera terrestre con Espana?	5
12	1	Con cuantos paises comparte Estados Unidos una frontera terrestre?	dos
13	1	Cuantos estados federales tiene Alemania?	16
14	1	Cuantos paises independientes hay dentro del continente de America del Sur?	Doce
15	1	Cuantas islas tiene Kuwait?	nueve
16	1	Cuantos rios hay en Arabia Saudita?	0
17	1	Cuantas zonas horarias tiene Rusia?	once
18	1	En Washington, D.C. que significa la "C"?	Columbia
19	1	En que pais se encuentra el municipio de Arteijo?	Espana
20	1	En que oceano se encuentra la isla de Reunion?	Oceano Indico
21	1	Japon tiene el trafico por el lado izquierdo.	Verdadero
22	1	Liechtenstein no tiene un aeropuerto.	Verdadero
23	1	Miami es la ciudad mas grande de Florida.	Falso
24	1	En que provincia canadiense se encuentra Montreal?	Quebec
25	1	New Haven es la capital del estado de Connecticut en los Estados Unidos.	Falso
26	1	En que continente se encuentra la cordillera de los Andes?	America del Sur
27	1	Ouagadougou es la capital de que pais africano?	Burkina Faso
28	1	El territorio moderno de Portugal fue una vez parte del Imperio Romano.	Verdadero
29	1	Rusia comparte una frontera terrestre con Corea del Norte.	Verdadero
30	1	Santorini es una isla que pertenece a que pais europeo?	Grecia
31	1	San Luis es la capital del estado estadounidense de Misuri.	Falso
32	1	El Principado de Sealand es una micronacion no reconocida frente a la costa de que pais?	El Reino Unido
33	1	Las montanas de los Pirineos estan ubicadas en la frontera de que dos paises?	Francia y Espana
34	1	El desierto de Sonora se encuentra en el este de Africa.	Falso
35	1	En que pais se encuentran los Acantilados Blancos de Dover?	Reino Unido
36	1	La sede de la Organizacion Mundial de la Salud se encuentra en que pais europeo?	Suiza
37	1	La capital de Brasil es Rio de Janeiro.	Falso
38	1	La capital de Indonesia es Bali.	Falso
39	1	La capital del estado estadounidense de Ohio es la ciudad de Chillicothe.	Falso
40	1	La ciudad de Konigsberg, antiguamente de Prusia Oriental, es conocida hoy como cual ciudad rusa?	Kaliningrado
41	1	En que pais de Africa Occidental se encuentra la ciudad historica de Tombuctu?	Mali
42	1	El montanoso paso de Jiber conecta cual de los dos siguientes paises?	Afganistan y Pakistan
43	1	No hay desiertos en Europa.	Verdadero
44	1	Existe una isla llamada "Java".	Verdadero
45	1	Hay 47 prefecturas en Japon.	Verdadero
46	1	Tokio es la capital de Japon.	Verdadero
47	1	Hasta 1939, Laos se llamaba Siam.	Falso
48	1	La Ciudad del Vaticano es un pais.	Verdadero
49	1	Que atraccion turistica norteamericana es servida por la compania de tours "Maid of the Mist"?	Cataratas del Niagara
50	1	Cuales son los cuatro estados esquineros de EE.UU.?	Utah, Colorado, Arizona, Nuevo Mexico
51	1	Que ciudad es conocida como la Capital de las Rosas del Mundo?	Tyler, Texas
52	1	En que ciudad se encuentra el Ejercito de Terracota?	Xi'an
53	1	Que pais no es parte de Escandinavia?	Finlandia
54	1	Que evento llevo a Liechtenstein a anadir una corona a su bandera?	Los Juegos Olimpicos de 1936
55	1	Cual es la isla mas grande de Canada?	Isla de Baffin
56	1	Que es Laos?	Pais
57	1	Cual es la 15a letra del alfabeto griego?	Omicron ()
58	1	Cual es la capital de los Estados Unidos?	Washington, D.C.
59	1	Cual es la palabra finlandesa para "Finlandia"?	Finlandia
60	1	Cual es el area de la Ciudad del Vaticano?	0,44km2
61	1	Cual es la capital de Bermudas?	Hamilton
62	1	Cual es la capital de Eslovenia?	Liubliana
63	1	Cual es la capital de Australia?	Canberra
64	1	Cual es la capital de Bangladesh?	Daca
65	1	Cual es la capital de Bielorrusia?	Minsk
66	1	Cual es la capital de Brasil?	Brasilia
67	1	Cual es la capital de Chile?	Santiago
68	1	Cual es la capital de Chipre?	Nicosia
69	1	Cual es la capital de Dinamarca?	Copenhague
70	1	Cual es la capital de India?	Nueva Delhi
71	1	Cual es la capital de Lituania?	Vilna
72	1	Cual es la capital de Peru?	Lima
73	1	Cual es la capital de Rumania?	Bucarest
74	1	Cual es la capital de Escocia?	Edimburgo
75	1	Cual es la capital de Seychelles?	Victoria
76	1	Cual es la capital de Eslovaquia?	Bratislava
77	1	Cual es la capital de Espana?	Madrid
78	1	Cual es la capital de Surinam?	Paramaribo
79	1	Cual es la capital del estado estadounidense de Arizona?	Fenix
80	1	Cual es el pais musulman mas grande del mundo?	Indonesia
81	1	Cual es el pais mas grande del mundo?	Federacion Rusa
82	1	Cual es el pais mas grande del mundo?	Rusia
83	1	Cual es el rio mas largo de Europa?	Volga
84	1	Cual es el nombre de la region rocosa que abarca la mayor parte del este de Canada?	Escudo Canadiense
85	1	Cual es el nombre del oceano en el que se encuentra Hawai?	Pacifico
86	1	Cual es el nombre de la peninsula que contiene a Espana y Portugal?	Peninsula Iberica
87	1	Cual es el apodo del estado estadounidense de Delaware?	El Primer Estado
88	1	Cual es el idioma oficial en Liechtenstein?	Aleman
89	1	Cual es el idioma oficial de Costa Rica?	Espanol
90	1	Cual es el unico estado de los Estados Unidos que no tiene una bandera en forma con 4 bordes?	Ohio
91	1	Como se llama la region que une Pakistan, India y China con un liderazgo desconocido?	Cachemira
92	1	Cual es la forma correcta de escribir la capital de Hungria?	Budapest
93	1	Cual es el pais mas pequeno del mundo?	Ciudad del Vaticano
94	1	Cual es la montana mas alta de Canada?	Monte Logan
95	1	Que nombre se uso historicamente para la ciudad turca actualmente conocida como Estambul?	Constantinopla
96	1	Cual era el nombre anterior de la nacion africana de Zimbabue?	Rodesia
97	1	Donde se encuentran las Lineas de Nazca?	Peru
98	1	Donde esta ubicado Fort Marlborough?	Bengkulu
99	1	Donde esta ubicada la Muralla de Adriano?	Carlisle, Inglaterra
100	1	Donde esta el rio Volga?	Rusia
101	1	Donde se encuentra la ciudad antigua de Petra?	Jordania
102	1	Donde esta ubicada la ciudad de Haarlem?	Paises Bajos
103	1	Cual es el barrio mas al norte de la Ciudad de Nueva York?	Bronx
104	1	Que provincia canadiense tiene a Charlottetown como su capital?	Isla del Principe Eduardo
105	1	En que condado ingles encontraras la Universidad de East Anglia?	Norfolk
106	1	Que ciudad europea tiene el mayor kilometraje de canales del mundo?	Birmingham
107	1	Que nacion oceaniana es conocida en maori como Aotearoa?	Nueva Zelanda
108	1	Que pais del Reino Unido presenta un dragon en su bandera?	Gales
109	1	Cual es el estado de EE.UU. tambien conocido como el "Estado de la Estrella Solitaria"?	Texas
110	1	Cual es la capital de Michigan?	Lansing
111	1	Que pais reclama la propiedad del estado disputado de Kosovo?	Serbia
112	1	Que pais no limita con Austria?	Francia
113	1	Que pais tiene la abreviatura "CH"?	Suiza
114	1	Que pais tiene tres capitales?	Sudafrica
115	1	Que pais dentro del Reino Unido NO aparece en su bandera, la Bandera de la Union?	Gales
116	1	En que pais se encuentra el rio Taedong?	Corea del Norte
117	1	Cual es el pais con la poblacion japonesa mas grande fuera de Japon?	Brasil
118	1	Cual es la ciudad mas grande de Marruecos?	Casablanca
119	1	Cual es el lago de agua dulce mas grande del mundo?	Lago Superior
120	1	Cual es la mas grande de estas 4 islas?	Borneo
121	1	Cual es el unico estado estadounidense ubicado completamente en la region de Apalaches?	Virginia Occidental
122	1	Cual es el pais mas pequeno del mundo?	Ciudad del Vaticano
123	1	Cual es el rio mas largo del mundo?	Nilo
124	1	Cual de los siguientes paises arabes NO tiene una bandera que contenga solo colores panarabes?	Qatar
125	1	Cual de los siguientes idiomas europeos esta clasificado como una "lengua aislada"?	Vasco
126	1	Cual de las siguientes islas japonesas es la mas grande?	Honshu
127	1	Cual de los siguientes paises es una isla?	Chipre
128	1	Cual de los siguientes es el rio mas largo de Europa?	Volga
129	1	Cual de los siguientes idiomas NO utiliza el alfabeto latino?	Georgiano
130	1	Cual de estas regiones africanas no limita directamente con la Republica Democratica del Congo?	Sudan
131	1	Cual de estas islas japonesas es la mas grande por area?	Shikoku
132	1	Cual de estas ciudades tiene una longitud de 4 Este?	Amsterdam
133	1	Cual de estos paises no es miembro de las Naciones Unidas?	Niue
134	1	Cual de las capitales de estos paises comienza con la letra B?	Libano
135	1	Cual de estos NO es una isla que forma parte de Filipinas?	Java
136	1	Cual de estos paises insulares se encuentra ubicado en el Caribe?	Barbados
137	1	Cual de estos lugares es una ubicacion en Cornualles?	Barcelona
138	1	Cual de estos paises limita con Polonia?	Lituania
139	1	Cual es el estado mas pequeno de los Estados Unidos?	Rhode Island
140	1	Que estrecho de agua conecta el oceano Atlantico con el mar Mediterraneo?	Estrecho de Gibraltar
141	2	"Cube", "Cube 2: Hipercubo" y "Cube Zero" fueron dirigidas por la misma persona.	Falso
142	2	"Make You Feel My Love" fue escrito y interpretado originalmente por cual cantautor?	Bob Dylan
143	2	La primera regla es: no hables de ello", es una referencia a que pelicula?	El club de la lucha
144	2	'74-'75 es un sencillo de 1993 del album Ring de que banda estadounidense?	Los Connells
145	2	Segun la tradicion de Star Wars, cual es el planeta natal de Han Solo?	Corellia
146	2	Despues de India, que pais produce la segunda mayor cantidad de peliculas por ano?	Nigeria
147	2	Que villano iconico de Batman de la serie de television de los anos 60 interpreto Cesar Romero?	El Payaso
148	2	La famosa revelacion de Darth Vader a Luke es iconica. Pero cual de estos es la correcta?	No. Soy tu padre.
149	2	El sello discografico EDM Monstercat firma pistas en lugar de artistas.	Verdadero
150	2	Ed Koch, el alcalde de Nueva York en 1984, se interpreto a si mismo en que pelicula de los Muppets?	Los Muppets conquistan Manhattan
151	2	Bajo que nombre han colaborado y lanzado temas los artistas electronicos Boys Noize y Skrillex?	Sangre de Perro
152	2	Eurobeat es principalmente un genero musical italiano.	Verdadero
153	2	Cuantos miembros tiene la banda Nirvana?	Tres
154	2	En "Jurassic World", cual es el nombre del dinosaurio que es un hibrido genetico?	Indominus Rex
155	2	En "Jurassic World", que empresa compra InGen y crea Jurassic World?	Corporacion Masrani Global
156	2	En "Rick and Morty", quien disparo a "Sr. Poopybutthole" en el episodio "Total Rickall"?	Beth
157	2	Que banda lanzo en 2006 su album debut "A Fever You Can't Sweat Out"?	Panic! At the Disco
158	2	En Buscando a Nemo, cual era el nombre de la mama de Nemo?	Coral
159	2	En Two and a Half Men, cual es el nombre del hijo de Alan Harper?	Jake
160	2	Con que se pago a la mayoria de los extras de Mad Max (1979) para reducir costos?	Cerveza
161	2	En la pelicula de 1976 'Taxi Driver', cuantas armas compro Travis al vendedor?	Cuatro
162	2	En la pelicula de 2014 "Birdman", cual es el instrumento principal de la banda sonora?	Tambores
163	2	En la serie Viernes 13, en que ano se ahogo Jason?	1957
164	2	En El Senor de los Anillos: Las Dos Torres, adonde lleva la partida de orcos a los hobbits?	Isengard
165	2	En que ano Clint Eastwood actuo como el Inspector Harry Callahan en la pelicula "Dirty Harry"?	1971
166	2	En que ano se estreno la primera pelicula de Transformers?	1986
167	2	En que estado de America nacio y se crio el Principe del Rap?	Pensilvania
168	2	En que ano se lanzo el album de Megadeth "Peace Sells... but Who's Buying?"?	1986
169	2	En que pelicula hizo Johnny Depp su debut en la pantalla grande?	A Nightmare on Elm Street
170	2	En que ciudad italiana se encuentra la opera La Fenice?	Venecia
171	2	El cantante principal Rivers Cuomo de la banda de rock estadounidense Weezer asistio a Harvard.	Verdadero
172	2	Que grupo de musica electronica fundo Liam Howlett en 1990?	The Prodigy
173	2	Como su personaje en "Parks and Recreation", Aziz Ansari nacio en South Carolina.	Verdadero
174	2	Metallica colaboro con Mr Bean de Rowan Atkinson en un sencillo de alivio comico de 1992.	Falso
175	2	Michael Jackson escribio la cancion de Los Simpson "Do the Bartman".	Falso
176	2	Nick Mason es el unico miembro en aparecer en todos los albumes de Pink Floyd.	Verdadero
177	2	En el episodio "Total Rickall" de la serie "Rick and Morty", quien era un parasito?	Lapicestre
178	2	El album de debut de Pink Guy fue "Pink Season".	Falso
179	2	El nombre real del rapero Snoop Dogg es 'Cordozar Calvin Broadus, Jr.'.	Verdadero
180	2	El productor escoces Calvin Harris es de la ciudad de Dumfries, Escocia.	Verdadero
181	2	La cancion de Queen "A Kind Of Magic" aparece en cual pelicula de 1986?	Highlander
182	2	De que album es la cancion "Give It Away" de Red Hot Chili Peppers?	Blood Sugar Sex Magik
183	2	En cual de sus canciones aparece la linea homonima de The Who, "Teenage Wasteland"?	Baba O' Riley
184	2	El autor detras de la aclamada novela "Leaving Las Vegas" tambien escribio un episodio de Rugrats.	Verdadero
185	2	El color de las pastillas en Matrix eran Azul y Amarillo.	Falso
186	2	La pelicula ficticia 'Rochelle, Rochelle' aparece en que sitcom?	Seinfeld
187	2	La pelicula "2001: Una odisea del espacio" se estreno el 31 de diciembre de 2000.	Falso
188	2	La pelicula Mad Max: Fury Road presenta el Dies Irae del requiem de que compositor?	Verdi
189	2	De cual ciudad inglesa es la banda de heavy metal Black Sabbath?	Birmingham
190	2	La cantante Billie Holiday tambien era conocida como "Lady Day".	Verdadero
191	2	La cancion "Mystery Train" fue lanzada por el artista "Little Junior's Blue Flames" en 1953.	Verdadero
192	2	La tuba es parte de que familia musical?	Laton
193	2	El arma que Clint Eastwood usa en "Dirty Harry" fue una .44 Automag.	Falso
194	2	Que programa de television trata sobre un abuelo que arrastra a su nieto en aventuras?	Rick y Morty
195	2	En que album se encuentra la cancion 'New Slang' de The Shins?	Oh, Mundo Invertido
196	2	Que raza de perro era Marley en la pelicula "Marley & Me" (2008)?	Labrador Retriever
197	2	Que mostraba la primera pelicula en movimiento?	Un caballo galopando
198	2	Que significa TIE en referencia al Caza TIE en "Star Wars"?	Motor de Ion Gemelo
199	2	Que genero de musica tocaba la banda Type O Negative?	Metal Gotico
200	2	Como se llama la guitarra de Brian May?	Guitarra Roja Especial
201	2	Cual no es un instrumento de viento?	Viola
202	2	Cual es el album mas vendido de todos los tiempos entre 1976 y 2018?	Suspenso
203	2	Cual es el nombre de nacimiento de Michael Caine?	Maurice Micklewhite
204	2	Cual es la primera cancion del album 808s & Heartbreak de Kanye West?	Dilo que haras
205	2	Cual es el nombre del personaje de James Dean en la pelicula de 1955 "Rebelde sin causa"?	Jim Stark
206	2	Cual es el nombre del sistema de Inteligencia Artificial en la pelicula "WarGames" de 1983?	Plan de Respuesta de Operacion de Guerra
207	2	Cual es el nombre de la primera pelicula de "Star Wars" por orden de lanzamiento?	Una nueva esperanza
208	2	Cual es el nombre de los antagonistas principales en Battlestar Galactica?	Los Cylones
209	2	Cual es el nombre del caballo de carreras al que Tony Soprano se encarina?	Pie-O-Mi
210	2	Cual es la pelicula de Disney mas antigua?	Blancanieves y los Siete Enanitos
211	2	Cual es la cancion de apertura en Pure Heroine de Lorde?	Cancha de Tenis
212	2	Cual es la especie del "Depredador" en la pelicula "Depredador" de 1987?	Yautja
213	2	Que cancion del album Black Face LP de ScHoolboy Q conto con la participacion de Kanye West?	Esa Parte
214	2	Cual era el nombre de pila del personaje de Marilyn Monroe en la pelicula "Con faldas y a lo loco"?	Azucar
215	2	Como se llamaba el quinto album de Taylor Swift?	1989
216	2	Cual fue el album mas vendido de 2015?	Adele, 25
217	2	Cual fue el primer videoclip transmitido en MTV?	El video mato a la estrella de la radio
218	2	Cual era el nombre del planeta en "Aliens"?	LV-426
219	2	Cual es el nombre de pila del Dr. Dofenshmirtz?	Heinz
220	2	Cual es la metrica mas comun para las canciones de rock?	4/4
221	2	Cuando se transmitio por primera vez la serie de television Rick and Morty en Adult Swim?	2013
222	2	Que banda de los 80 esta liderada por el cantante/guitarrista Robert Smith?	The Cure
223	2	Cual villano de Batman es Mark Hamill conocido por haber doblado?	El Payaso
224	2	Cual Beatle lidero el camino cruzando el paso de cebra en la portada del album Abbey Road?	Juan
225	2	Cual album de The Beatles NO presenta a ningun miembro de la banda en su portada?	Los Beatles (Album Blanco)
226	2	De cual album de Daft Punk es la cancion "Harder, Better, Faster, Stronger"?	Descubrimiento
227	2	Cual actor audiciono para el papel de Luke Skywalker?	Kurt Russell
228	2	Que actor de The Young Ones tambien interpreto a Lord Flashheart en un episodio de Blackadder II?	Rik Mayall
229	2	Que actriz interpreto a la Dra. Grace Augustine en la pelicula "Avatar" de James Cameron?	Sigourney Weaver
230	2	Cual fue la primera pelicula animada en presentar a una celebridad como actor de voz?	Aladin
231	2	Que banda tuvo exitos en 1975 con las canciones 'One Of These Nights' y 'Lyin Eyes'?	Las Aguilas
232	2	Que famoso rapero aparece en el sencillo "Febreze" de 2015 de Jack U (Skrillex y Diplo)?	2 Chainz
233	2	Que exmiembro de una banda de chicos lanzo el exitoso sencillo en solitario "Angels" en 1997?	Robbie Williams
234	2	Que miembro de "The Beatles" narro episodios de "Thomas the Tank Engine"?	Ringo Starr
235	2	Cual de estas peliculas NO conto con la participacion del difunto actor John Candy?	Cazafantasmas
236	2	Cual de los albumes de Michael Jackson fue el que mas copias vendio?	Suspenso
237	2	Cual de los miembros de la banda Beatles esta descalzo en la portada del album 'Abbey Road'?	Paul McCartney
238	2	Cual de las siguientes bandas no es parte de Tom DeLonge?	+44
239	2	Cual de los siguientes guitarristas grabo un album como miembro de los Red Hot Chili Peppers?	Dave Navarro
240	2	Cual de los siguientes NO es una cancion real de la banda Thousand Foot Krutch?	Furia Sin Limites
241	2	Cual de los siguientes no es un album de estudio de la banda Pink Floyd?	Peliculas en movimiento
242	2	Cual de estos personajes de BoJack Horseman es un humano?	Todd Chavez
243	2	Cual de estos clasicos de Disney fue lanzado en 1970?	Los Aristogatos
244	2	Cual de estas peliculas NO fue lanzada en 1996?	Gladiador
245	2	Cual de estos programas de juegos de Nickelodeon se transmitio primero?	Doble Atrevimiento
246	2	Cual de estos actores NO ha interpretado a Spiderman en las peliculas?	Michael Cera
247	2	Cual de estos NO es el nombre de un album lanzado por el productor de Miami DJ Khaled?	Nunca te Juegues a ti Mismo
248	2	Cual de estas peliculas NO se considera parte del Universo Cinematografico de Marvel?	Los Cuatro Fantasticos (2015)
249	2	Cual de estas canciones fue una version de Jimi Hendrix?	Todas estas canciones
250	2	Cual de estas canciones NO fue lanzada en los 90s?	"I Want It All" de Queen
251	2	Cual de estas canciones fue lanzada en 1996?	The Smashing Pumpkins - "1979"
252	2	Cual de estas peliculas dirigio David Lynch pero no escribio?	La historia recta
253	2	Cual de estas canciones NO hizo el grupo "Men At Work"?	La Danza de la Seguridad
254	2	Que cantante fue presentada en la cancion "Where Are U Now" de Jack U (Skrillex & Diplo) de 2015?	Justin Bieber
255	2	Cual cancion NO es de Tom Jones?	Never Gonna Give You Up
256	2	Cual es el pueblo donde transcurre la pelicula de Disney Herbie, loco de amor (1968)?	San Francisco
257	2	Cual fue la primera pelicula de Alfred Hitchcock filmada en color?	Cuerda
258	2	En que ano se lanzo el primer YouTube Rewind oficial?	2010
259	2	Quien dirigio la pelicula de 1973 "American Graffiti"?	George Lucas
260	2	Quien tuvo un exito numero 1 en EE.UU. y Reino Unido en 1962 con el instrumental 'Telstar'?	Los Tornados
261	2	Quien es el director de la pelicula de 1991 "El silencio de los corderos"?	Jonathan Demme
262	2	Quien es el vocalista y lider de la banda de rock "Guns N' Roses"?	Axl Rose
263	2	Quien interpreto a Thanos en Avengers: Infinity War y Avengers: End Game?	Josh Brolin
264	2	Quien interpreto a la Camarera en el sketch de Spam de "Monty Python's Flying Circus"?	Terry Jones
265	2	Quien interpreto a Han Solo en la serie de peliculas principales de Star Wars?	Harrison Ford
266	2	Quien canto la cancion del tema de apertura de la pelicula de James Bond de 1995 'Goldeneye'?	Tina Turner
267	2	Quien fue el primer ganador de Big Brother US en ganar con un juego perfecto?	Dan Gheesling
268	2	Quien era el miembro mas antiguo de The Beatles?	Ringo Starr
269	2	Quien fue el ganador de "Big Brother" Temporada 10?	Dan Gheesling
270	2	Quien escribio la composicion musical "Rhapsody in Blue"?	George Gershwin
271	2	Quien escribio la cancion "You Know You Like It"?	AlunaGeorge
272	3	"Si, America Puede!" fue el eslogan de campana de facto de este politico estadounidense en 2004.	George W. Bush
273	3	Adolf Hitler fue aceptado en la Academia de Bellas Artes de Viena.	Falso
274	3	Adolf Hitler fue juzgado en los juicios de Nuremberg.	Falso
275	3	Despues de su derrota en la Batalla de Waterloo, a que isla fue exiliado Napoleon Bonaparte?	Santa Elena
276	3	Durante las invasiones mongolas de Japon, que detuvo principalmente los barcos mongoles?	Tifones
277	3	George W. Bush perdio el voto popular en la eleccion presidencial de Estados Unidos de 2004.	Falso
278	3	De que pais era Hong Kong una parte del territorio antes de que Gran Bretana lo recuperara en 1945?	Japon
279	3	Como llamaban los vikingos a su colonia de corta duracion en el Canada actual?	Tierra de Vinedos
280	3	Cuanto tiempo duro la Segunda Guerra Mundial?	6 anos
281	3	Cuanto tiempo duro el Levantamiento de Varsovia durante la Segunda Guerra Mundial?	63 Dias
282	3	Cuantas sonatas escribio Ludwig van Beethoven?	treinta y dos
283	3	Cuantos anos tenia Adolf Hitler cuando murio?	cincuenta y seis
284	3	En 1547 quien se convirtio en el primer Zar de Rusia	Ivan el Terrible
285	3	En 1845, una serie de guerras nombradas segun que pueblo indigena comenzo en Nueva Zelanda?	Maori
286	3	En la Segunda Guerra Mundial, los Hawker Typhoon sirvieron en el teatro del Pacifico.	Falso
287	3	En relacion con la Ocupacion Britanica en Irlanda, que significa IRA?	Ejercito Republicano Irlandes
288	3	En que dialogo Socrates se defendio ante la corte de Atenas?	La Apologia
289	3	En que ano ocurrio el Crash de Videojuegos de America del Norte?	1983
290	3	En que pais se construyo la Estatua de la Libertad y se exporto a los Estados Unidos de America?	Francia
291	3	En cual de estas ciudades ocurrio la Gran Peste de 1858?	Londres
292	3	En que guerra ocurrieron los bombardeos atomicos de Hiroshima y Nagasaki?	Segunda Guerra Mundial
293	3	En que ano fue liberado Nelson Mandela de la prision?	1990
294	3	Japon fue parte de las Potencias Aliadas durante la Primera Guerra Mundial.	Verdadero
295	3	En que dia invadio Alemania a Polonia?	1 de septiembre de 1939
296	3	En que dia ARPANET sufrio una caida de red de 4 horas?	27 de octubre de 1980
297	3	Pianista Frederic Chopin fue compositor de que era musical?	Romantico
298	3	Rusia aprobo una ley en 2013 que prohibe decirles a los ninos que los homosexuales existen.	Verdadero
299	3	Taiwan se llama oficialmente "la Republica de China".	Verdadero
300	3	La Batalla del Somme en la Primera Guerra Mundial tuvo lugar en que pais?	Francia
301	3	La Guerra Fria termino con la muerte de Jose Stalin.	Falso
302	3	La Casa Fallingwater, ubicada en Pensilvania, fue disenada por que arquitecto?	Frank Lloyd Wright
303	3	La Cuarta Cruzada duro de 1095-1099 d.C.	Falso
304	3	Que emperador del Imperio Bizantino encargo la construccion de la Hagia Sophia?	Justiniano I
305	3	La Pequena Entente fue una alianza formada contra que nacion?	Hungria
306	3	Bajo la administracion de que presidente estadounidense se termino el Canal de Panama?	Woodrow Wilson
307	3	La S en Harry S. Truman significa "Solomon".	Falso
308	3	El Spitfire L.F. Mk IX tenia que motor?	Merlin 66
309	3	Las protestas de la Plaza de Tiananmen de 1989 se llevaron a cabo en Hong Kong.	Falso
310	3	Estados Unidos fue miembro de la Liga de las Naciones.	Falso
311	3	De que nacionalidad era el creador de la Cifra y Maquina Enigma?	Aleman
312	3	Para que proposito se construyo originalmente la corona del edificio Empire State?	Muelle de Dirigibles
313	3	La mayoria de las personas que vivieron bajo el Imperio Bizantino se llamaban a si mismas romanos.	Verdadero
314	3	El hombre que disparo a Alexander Hamilton se llamaba Aaron Burr.	Verdadero
315	3	La ametralladora rotatoria fue disenada en 1960 por que fabricante?	General Electric
316	3	Theresa May fue la primera ministra del Reino Unido.	Falso
317	3	Estos dos paises mantuvieron una mancomunidad del siglo XVI al XVIII.	Polonia y Lituania
318	3	A que partido politico pertenecia Abraham Lincoln cuando fue elegido presidente?	Republicano
319	3	Los vikingos fueron los primeros europeos en descubrir America del Norte.	Verdadero
320	3	Que pais del sudeste asiatico era conocido anteriormente como 'Lan Xang'?	Laos
321	3	A que edad murio el Rey Enrique V?	treinta y cinco
322	3	Cual fue la batalla mas larga de la Primera Guerra Mundial, durando aproximadamente 303 dias?	Batalla de Verdun
323	3	Que candidato gano la Eleccion Presidencial de los EE.UU. de 2012?	Barack Obama
324	3	Que dia comenzo la Batalla de Gettysburg?	1 de julio de 1863
325	3	Que dispensaban las primeras maquinas expendedoras a principios de los anos 1880?	Tarjetas postales
