313	5	Originally used in PCM adapters, what frequency is the standard for sampling audio in the Compact Disc Digital Audio format?	44.1 kHz
314	5	Sea sponges can have hearts.	False
315	5	The 'Raspberry Pi' series of single-board computers were created in the United States.	False
316	5	The Windows 7 operating system has six main editions.	True
317	5	The decimal number 31 in hexadecimal would be what?	1F
318	5	The difference between the lengths of a Boeing 777-300ER and an Airbus A350-1000 is closest to:	0.1m
319	5	The medial meniscus forms which part of what joint in the human body?	Knee
320	5	The medical term for the belly button is which of the following?	Umbilicus
321	5	The notion of a "set that contains all sets which do not contain themselves" is a paradoxical idea attributed to which English philosopher?	Bertrand Russel
322	5	The planet Mars has two moons orbiting it.	True
323	5	The set of all algebraic numbers is countable.	True
324	5	To which biological phylum do all mammals, birds and reptiles belong?	Chordata
325	5	What color is a Steller's Jay?	blue and black
326	5	What color/colour is a polar bear's skin?	Black
327	5	What common name is given to the medial condition, tibial stress syndrome (MTSS)?	Shin Splints
328	5	What does GHz stand for?	Gigahertz
329	5	What does the scientific name of the Cambrian-Period sea creature Anomalocaris mean?	Abnormal Shrimp
330	5	What is "Stenoma"?	A genus of moths
331	5	What is the Roman numeral for 500?	D
332	5	What is the SI unit for resistance?	Ohms
333	5	What is the alphanumeric representation of the imaginary number?	i
334	5	What is the common name of the chemical compound "dihydrogen monoxide"?	Water
335	5	What is the fastest road legal car in the world?	Koenigsegg Agera RS
336	5	What is the largest living organism currently known to man?	Honey Fungus
337	5	What is the medical term for low blood sugar?	Hypoglycemia
338	5	What is the smallest number that can be expressed as the sum of two positive cubes in two different ways?	1729
339	5	What language does Node.js use?	JavaScript
340	5	What produces the green colour of most plant leaves?	Chlorophyll
341	5	When was the iPhone released?	2007
342	5	Where did the dog breed "Chihuahua" originate?	Mexico
343	5	Which Japanese company is the world's largest manufacturer of motorcycles?	Honda
344	5	Which SQL keyword is used to fetch data from a database?	SELECT
345	5	Which animal was part of an Russian domestication experiment in 1959?	Foxes
346	5	Which car manufacturer created the "Aventador"?	Lamborghini
347	5	Which class of animals are newts members of?	Amphibian
348	5	Which coding language was the #1 programming language in terms of usage on GitHub in 2015?	JavaScript
349	5	Which greek mathematician ran through the streets of Syracuse naked while shouting "Eureka" after discovering the principle of displacement?	Archimedes
350	5	Which horizon in a soil profile consists of bedrock?	R
351	5	Which is the most abundant element in the universe?	Hydrogen
352	5	Which of the following plastic is commonly used for window frames, gutters and drain pipes?	Polyvinylchloride (PVC) 
353	5	Which of these elements on the Periodic Table is a Noble Gas?	Neon
354	5	Which of these is used to show that Earth spins on an axis? 	Foucault Pendulum 
355	5	Which of these species is not extinct?	Komodo dragon
356	5	Which one of these is scientific term for "Brain Freeze"?	Sphenopalatine Ganglioneuralgia
357	5	Which scientific unit is named after an Italian nobleman?	Volt
358	6	A stimpmeter measures the speed of a ball over what surface?	Golf Putting Green
359	6	ATP tennis hosted several tournaments on carpet court before being replaced to reduce injuries.	True
360	6	At which bridge does the annual Oxford and Cambridge boat race start?	Putney
361	6	At which race was the 2018 F1 Drivers Championship won?	Mexico
362	6	During Wimbledon, spectators in the grounds can buy the tennis balls that have been used in matches.	True
363	6	Edson Arantes do Nascimento is the full name of which legendary football player?	Pele
364	6	Hockey player Wayne Gretzky was born in what Canadian province?	Ontario
365	6	How many French Open's did Bjorn Borg win?	6
366	6	How many players are there in an association football/soccer team?	11
367	6	How many scoring zones are there on a conventional dart board?	82
368	6	How many soccer players should be on the field at the same time?	22
369	6	In 2016, who won the Formula 1 World Constructor's Championship for the third time in a row?	Mercedes-AMG Petronas
370	6	In Baseball, how many times does the ball have to be pitched outside of the strike zone before the batter is walked?	4
371	6	In Canadian football, scoring a rouge is worth how many points?	1
372	6	In Formula 1, the Virtual Safety Car was introduced following the fatal crash of which driver?	Jules Bianchi
373	6	In Rugby League, performing a "40-20" is punished by a free kick for the opposing team.	False
374	6	In association football, or soccer, a corner kick is when the game restarts after someone scores a goal.	False
375	6	In baseball, how many fouls are an out?	0
376	6	In golf, what name is given to a hole score of two under par?	Eagle
377	6	In what country were the 2014 Winter Olympics held in the town of Sochi?	Russia
378	6	In what sport does Fanny Chmelar compete for Germany?	Skiing
379	6	Prior to 2018, which car company is the only Japanese company which won the 24 Hours of Le Mans?	Mazda
380	6	Roger Federer is a famous soccer player.	False
381	6	Skateboarding was included in the 2020 Summer Olympics in Tokyo.	True
382	6	Soccer player Cristiano Ronaldo opened a museum dedicated to himself.	True
383	6	Tennis was once known as Racquetball.	False
384	6	The 1988 Formula 1 season had McLaren win all but one race, what race did they not win?	Italian Grand Prix
385	6	The F1 season of 1994 is remembered for what tragic event?	Death of Ayrton Senna (San Marino)
386	6	The Los Angeles Dodgers were originally from what U.S. city?	Brooklyn
387	6	The Olympics tennis court is a giant green screen.	True
388	6	The Rio 2016 Summer Olympics held it's closing ceremony on what date?	August 21
389	6	There are a total of 20 races in Formula One 2016 season.	False
390	6	What cricketing term denotes a batsman being dismissed with a score of zero?	Duck
391	6	What is the full name of the footballer "Cristiano Ronaldo"?	Cristiano Ronaldo dos Santos Aveiro
392	6	What is the name of Manchester United's home stadium?	Old Trafford
393	6	What is the name of the "tool" used to hit the white ball in snooker or billiards?	Cue
394	6	What is the oldest team in Major League Baseball?	Atlanta Braves
395	6	What national team won the first UEFA Nations League?	Portugal
396	6	What team did England beat in the semi-final stage to win in the 1966 World Cup final?	Portugal
397	6	What was the final score of the Germany vs. Brazil 2014 FIFA World Cup match?	7 - 1
398	6	What year was hockey legend Wayne Gretzky born?	1961
399	6	Which Formula 1 driver switched teams in the middle of the 2017 season?	Carlos Sainz Jr.
400	6	Which German sportswear company's logo is the 'Formstripe'?	Puma
401	6	Which car manufacturer won the 2017 24 Hours of Le Mans?	Porsche
402	6	Which city features all of their professional sports teams' jersey's with the same color scheme?	Pittsburgh
403	6	Which country hosted the 2022 FIFA World Cup?	Qatar
404	6	Which country produced football players such as Cafu, Roberto Carlos and Pele?	Brazil
405	6	Which darts player has won the most World Championship titles?	Phil Taylor
406	6	Which is Kenesisa Bekele's personal best at marathon?	2:01:41
407	6	Which nation hosted the FIFA World Cup in 2006?	Germany
408	6	Which of the following pitchers was named National League Rookie of the Year for the 2013 season?	Jose Fernandez
409	6	Which of the following sports is not part of the triathlon?	Horse-Riding
410	6	Which of these European cities was the first to host the modern Summer Olympic Games three times?	London
411	6	Which of these Russian cities did NOT contain a stadium that was used in the 2018 FIFA World Cup?	Vladivostok
412	6	Which of these teams has Jaromir Jagr not played for?	New York Islanders
413	6	Which of these track-and-field events is NOT included in the Olympic men's decathlon?	Hammer throw
414	6	Which soccer team won the Copa America 2015 Championship ?	Chile
415	6	Which sport is NOT traditionally played during the Mongolian Naadam festival?	American Football
416	6	Which year did Jenson Button won his first ever Formula One World Drivers' Championship?	2009
417	6	Who has played the most tournaments on the Brazilian national soccer team?	Cafu
418	6	Who is Manchester United's leading appearance maker?	Ryan Giggs
419	6	Who was the top scorer of the 2014 FIFA World Cup?	James Rodriguez
420	6	Who was the topscorer for England national football team?	Wayne Rooney
421	6	Who won the 2015 College Football Playoff (CFP) National Championship? 	Ohio State Buckeyes
422	6	Who won the 2015 Formula 1 World Championship?	Lewis Hamilton
423	6	Who won the 2016 Formula 1 World Driver's Championship?	Nico Rosberg
424	6	Who won the 2017 Formula One World Drivers' Championship?	Lewis Hamilton
425	6	Who won the 2018 Monaco Grand Prix?	Daniel Ricciardo
426	6	Who won the UEFA Champions League in 2016?	Real Madrid C.F.
427	6	Who won the UEFA Champions League in 2017?	Real Madrid C.F.
428	6	With which doubles partner did John McEnroe have most success?	Peter Fleming
429	7	 Which chemical element, number 11 in the Periodic table, has the symbol Na?	Sodium
430	7	"Ananas" is mostly used as the word for Pineapple in other languages.	True
431	7	"Gum arabic" is a natural gum consisting of the hardened sap of which tree species?	Acacia
432	7	According to Fair Works Australia, how long do you have to work to get Long Service Leave?	7 years
433	7	According to the Book of Genesis in the Old Testament, how many days did it take God to create the world?	Six
434	7	According to the United States' CDC, one in how many Americans die annually due to smoking?	Five
435	7	Adolf Hitler was born in Australia. 	False
436	7	Apple co-founder Steve Jobs died from complications of which form of cancer?	Pancreatic
437	7	Area 51 is located in which US state?	Nevada
438	7	Chartreuse is a color between yellow and what?	Green
439	7	French is an official language in Canada.	True
440	7	Haggis is traditionally ate on Burns Night.	True
441	7	How many colors are there in a rainbow?	7
442	7	How many furlongs are there in a mile?	Eight
443	7	How many letters are there in the English alphabet?	26
444	7	If you planted the seeds of Quercus robur, what would grow?	Trees
445	7	In a standard set of playing cards, which is the only king without a moustache?	Hearts
446	7	In aerodynamics, which force pushes an object upwards?	Lift
447	7	In what year did Canada stop producing the penny?	2012
448	7	Instant mashed potatoes were invented by Canadian Edward Asselbergs in 1962.	True
449	7	Kraft "Cheez Whiz" contains cheese culture, but doesn't actually contain cheese	True
450	7	Linus Pauling, one of the only winners of multiple Nobel Prizes, earned his Nobel Prizes in Chemistry and what?	Peace
451	7	Macintosh has named six of its operating systems after big cats. What big cat did Macintosh name their 2007 release after? 	Leopard
452	7	Nutella is produced by the German company Ferrero.	False
453	7	On average, at least 1 person is killed by a drunk driver in the United States every hour.	True
454	7	Ping-Pong originated in England	True
455	7	Pluto is a planet.	False
456	7	Red Vines is a brand of what type of candy?	Licorice
457	7	Samhainophobia is the term used for an abnormal and persistent fear of halloween.	True
458	7	Sciophobia is the fear of what?	Shadows
459	7	Terry Gilliam was an animator that worked with which British comedy group?	Monty Python
460	7	The British organisation CAMRA stands for The Campaign for Real Ale.	True
461	7	The French word to travel is "Travail"	False
462	7	The Great Wall of China is visible from the moon.	False
463	7	The National Animal of Scotland is the Unicorn.	True
464	7	The Quran is the holy book of which Abrahamic religion?	Islam
465	7	The bikini is named after the "Bikini Atoll", an island where the United States conducted tests on atomic bombs.	True
466	7	The word "abulia" means which of the following?	The inability to make decisions
467	7	The words "bungalow" and "shampoo" originate from the languages of which country?	India
468	7	Virgin Trains, Virgin Atlantic and Virgin Racing, are all companies owned by which famous entrepreneur?   	Richard Branson
469	7	What airline was the owner of the plane that crashed off the coast of Nova Scotia in 1998?	Swiss Air
470	7	What company owns Outlook?	Microsoft
471	7	What do sailors call the front of a boat?	Bow
472	7	What does the F stand for in the FBI?	Federal
473	7	What is "dabbing"?	A dance
474	7	What is a Burgee?	A flag
475	7	What is the German word for "spoon"?	Loffel
476	7	What is the Portuguese word for "Brazil"?	Brasil
477	7	What is the Spanish word for "donkey"?	Burro
478	7	What is the average life span of a garden ant?	15 years
479	7	What is the first book of the Old Testament?	Genesis
480	7	What is the largest rapid transit system in the world by number of stations, with 472 stations in operation?	New York City Subway
481	7	What is the longest bridge in the world?	Danyang-Kunshan Grand Bridge, China
482	7	What is the name of Poland in Polish?	Polska
483	7	What is the name of the poker hand containing three of a kind and a pair?	Full House
484	7	What is the romanized Japanese word for "university"?	Daigaku
485	7	What is the shape of the toy invented by Hungarian professor Erno Rubik?	Cube
486	7	What is the unit of currency in Laos?	Kip
487	7	What year was Walt Disney born?	1901
488	7	When you cry in space, your tears stick to your face.	True
489	7	Which American manufactured submachine gun was informally known by the American soldiers that used it as "Grease Gun"?	M3
490	7	Which mountain has the highest peak in Australia?	Mount Kosciuszko, New South Wales
491	7	Which of the following correctly describes Japanese word order?	Subject Object Verb
492	7	Which of the following languages does NOT use gender as a part of its grammar?	Turkish
493	7	Which one of these is not a typical European sword design?	Scimitar
494	7	Which sign of the zodiac is represented by the Crab?	Cancer
495	7	Which type of cutlery is most suited for eating soup?	Spoon
496	7	Who invented the first ever chocolate bar, in 1847?	Joseph Fry
497	7	Who played General Aladeen in The Dictator?	Sacha Baron Cohen
498	7	You are allowed to sell your soul on eBay.	False
499	7	You can legally drink alcohol while driving in Mississippi.	True
